Genero,Artista,Titulo,Cancion
Salsa,Grupo Niche,Se Parece Tanto A Ti,"Quien no dice una mentira
Por consevar un amor
Quien no inventa una historieta
Por evitar un dolor

Quien no se moja los labios con otros que sepan a miel

Quien no cae en el deseo
Y terminar siendo infiel...

Recordar todo en silencio
Como extraños nos sentimos

Paso a paso detallamos
Con sinismo comparamos
Y esa duda q nos mata
Y que asalta q atenaza
Tus sentidos los vulnera
Nos tortura nos delata
Y no saber si es mejor
Mientras duerme le relatas:

Amor se pareció tanto a ti,
que no pude guardar en mi cuerpo el deseo que la tuve que amar
sentí la necesidad de tenerme que entregar,
sentí miedo sentí el peso de poderme equivocar
Fue como llegar a casa primero de mi viaje
Como empezar de nuevo, después de disgustar,
como adelantar las caricias cuando nos pensábamos casar
o sentir la melodia antes de hacer esta canción
como si la noche durara un poco mas en vez de amanecer
como si la lluvia cayera sin presagio cuando hay sol
como si el sueño se realizara mucho antes de morir
como si el niño llorara mucho antes de nacer

Amor se pareció tanto a ti,
que el nombre llevaban por igual
y la misma prisa cuando solian caminar
y hasta en la sonrisa me parecieron tan igual
sentí miedo sentí el peso
de quererme enamorar otra vez...

Y no podria decirle otra cosa si la veo,
que la extraño, que la pienso
Y no podria decirle otra cosa si la veo
y sigues viviendo en mi quisiera hacerte feliz y no puedo
Y no podria decirle otra cosa si la veo
que no soy yo quien decide en este caso
por eso el motivo y la causa de mi fracaso
Y no podria decirle otra cosa si la veo
que la extraño que lo siento

Y no podria decirle otra cosa si la veo
que lo siento, ohhh"
Salsa,Grupo Niche,Enamorada,"Cuando llega tocando a tu puerta
Es porque sabe cuál será la respuesta
Y que no habrá un no porque lo necesitas
Si el fuego crece te va dando las pistas

Sentir que entre unos brazos te deshaces
Y que tiemblas y no es de miedo
Llorar porque lo que amas está lejos
Reírte a solas para ti, eso es nuevo

Es como ver la vida de otra manera
Tocar el cielo en una noche de estrellas
Y darse cuenta al tiempo que lo bello
Tiene sentido cuando lo expresamos
Con un beso, nada más

Mucho mejor es jugar con la arena
O ver las aves que entre nubes se elevan
Y pico a pico, boca a boca, boca
Labios que con labios se rozan
Una caricia, eso es amar

Estás ardiendo, estás ilusionada
No te conocen, estás extasiada
Y darás todo por sentirte amada
Y mucho más si estás enamorada

Sentir que entre unos brazos te deshaces
Y que tiemblas y no es de miedo
Llorar porque lo que amas está lejos
Reírte a solas para ti, eso es nuevo

Es como ver la vida de otra manera
Tocar el cielo en una noche de estrellas
Y darse cuenta al tiempo que lo bello
Tiene sentido cuando lo expresamos
Con un beso, nada más

Mucho mejor es jugar con la arena
O ver las aves que entre nubes se elevan
Y pico a pico, boca a boca, boca
Labios que con labios se rozan
Una caricia, eso es amar

(Nunca preguntas qué hay en mi ropero
Lo que me pongo, sabes cuándo lo llevo)
Me agrada y me llena cómo te manifiestas
Contigo todos los días parecen una fiesta

(Nunca preguntas qué hay en mi ropero
Lo que me pongo, sabes cuándo lo llevo)
Nunca te separes de mí
Nunca amor lo pienses, que yo muero de miedo

(Nunca preguntas qué hay en mi ropero
Lo que me pongo, sabes cuándo lo llevo)
Por eso es que tú tienes las cosas bellas
Que Dios hizo lindas en una mujer

(Nunca preguntas qué hay en mi ropero
Lo que me pongo, sabes cuándo lo llevo)
Cómo no agradecer
Si cuando me equivoco, solo ríes
Y no te da siquiera por murmurar

(Nunca preguntas qué hay en mi ropero
Lo que me pongo, sabes cuándo lo llevo)
A qué saben los limones, limones
Primero ella los prueba
A ver si están amarillos o pintones"
Salsa,Grupo Niche,Un Día Después,"(En el mismo lugar sigue Cartagena,
Con la misma playa, con la misma arena
En el mismo lugar sigue Cartagena)

No tembló la tierra,
No se calmaron las olas del mar,
No hubo flores en mi sepultura,
A mi dolor ya encontré la cura.

La iglesia está en la plaza,
La calle que da al atrio sigue oscura,
Y nadie acuso al alcalde
Por hacer con el fisco travesuras.

No se acabó la magia,
El campo sigue verde y plana la llanura
No se calló mi perro que otro patio cuida
Cuando demoro cuando no llego.

No se escapó la lora,
Que aun sigue hablando de todas las señoras,
Tibio a amanecer, luce en la aurora
Y no deja de salir el sol.

No causó el efecto que imaginaste,
No me hizo el daño que tú pensaste,
No lloré más de lo que creíste,
No hiciste falta cuando te fuiste.

Y no sentí la ira que pasa lenta, no
Que es la que hace estragos, con el tiempo aumenta
Sólo traté de olvidar, ni más faltaba
El trago amargo que tú me dabas.

No cambió el horario,
El tren de siete lleva el pan trae el diario,
No se paró la mula que el arado arrastra
Y la pobre sigue en vida.

Pastando está el bisonte,
La hiena no da tiempo a traer el corte.
Para una princesa un consorte
De sueños de un plebeyo que hay al norte.

Y brillan las estrellas,
La luna en otro sitio sigue bella,
En pleno verano Marbella,
En el mismo lugar sigue Cartagena.

No causó el efecto que imaginaste,
No me hizo el daño que tú pensaste,
No lloré más de lo que creíste,
No hiciste falta cuando te fuiste.

Y no sentí la ira que pasa lenta, ah
Que es la que hace estragos, con el tiempo aumenta
Sólo traté de olvidar, ni más faltaba
El trago amargo que tú me dabas.

El trago amargo que tú me dabas,
El trago amargo que tú me dabas.

(En el mismo lugar sigue Cartagena
Con la misma playa, con la misma arena)

(En el mismo lugar sigue Cartagena
Con la misma playa, con la misma arena)
Quien lo diría
Sigue latiendo mi corazón
Ya comprobé que sin ti no me muero, no
(En el mismo lugar sigue Cartagena
Con la misma playa, con la misma arena)
Y no deja de brillar el sol)
El tiempo marca las doce
Por la misma puerta del reloj
(En el mismo lugar sigue Cartagena
Con la misma playa, con la misma arena)
Y yo no veo que se mueva
Con la misma arena,
La popa sigue vigilante sobre San Felipe y el Caribe

(Tengo suficientes razones de peso)
Tengo motivos para estar en paz conmigo
(Tengo suficientes razones de peso)
Para no pensarte, para no extrañarte, para no tenerte
(Tengo suficientes razones de peso)
Quien, quien, quien dice que no puedo defenderme
Como una fiera herida
(Tengo suficientes razones de peso)
Como yo sufrí por ti nadie daba nada
(Tengo suficientes razones de peso)
Pero, pero, pero por mi camino
Voy aunque mucho me haya dolido
(Tengo suficientes razones de peso)
Se me olvidó, ya no te quiero

María mulata, María mulata, María mulata
(Tengo suficientes razones de peso)"
Salsa,Grupo Niche,Es mejor no despertar,"Después de soñar, soñar y soñar contigo
Es mejor no despertar
Es mejor no despertar testigo

Después de soñar, soñar y soñar contigo

Porque al saber que ya no estás
Empezaré yo a preguntar
Y quién sabe cuántas vueltas
A la tierra vaya a dar

Yo la manera inventaré
De alguna forma te hallaré
Y este sueño que se llama amor
Lo seguiré

Después de soñar, soñar y soñar contigo
Es mejor no despertar
Es mejor no despertar que alivio

Después de soñar, soñar y soñar contigo

Es ir al cielo y no bajar, no pensar nunca en regresar
Y esta fiebre que se llama amor no terminar
Tu aliento puro respirar
Todo lo tuyo adivinar
Y tus labios rojos yo besar

Después de soñar contigo
Después de soñar contigo
Es mejor no despertar

Nunca supe que el cielo estaba cerca
Hasta que llegaste tú

Me has enseñado a valorar
A distinguir entre el bien y el mal
Me has enseñado a conjugar el verbo amar
En todos los modos, solo a ti puedo querer

Nunca supe que el cielo estaba cerca
Hasta que llegaste tú

Eres la esencia, eres luz que en la inocencia
Iluminas mi vida sanando bien las heridas

Nunca supe que el cielo estaba cerca
Hasta que llegaste tú, tú

Nunca supe que el cielo estaba cerca
Nunca supe que el cielo estaba cerca

Eres la única que a mí me hace sentir feliz

Nunca supe que el cielo estaba cerca

Secretos de la vida que me toman por sorpresa
Eso eres tú, para mí tú

Nunca supe que el cielo estaba cerca"
Salsa,Grupo Niche,Cali Aji,"Si por la quinta vas pasando
Es mi Cali bella que vas atravesando
Si por la tarde las palmeras se mueven alegres
La noche está esperando

Si por la quinta vas pasando
Es mi Cali bella que vas atravesando
Si por la tarde las palmeras se mueven alegres
La noche está esperando

No hay caña dulce que se esté quieto
Y quiere que lo piquen pa' que se vuelva aguardiente

No hay nadie que se quede en casa
Un día en la caminata pa' gozar la cabalgata

Y usted, amigo, que viene de lejos
Agarre pues la suya que se me vuelve pendejo

Y fiesta y rumba
Y rumba que es la feria de la caña
Y fiesta y rumba
Y rumba que es la feria de la caña

La gente está en la plaza
El toro que es de casta, ole

Yo me lo como con ají
Me lo paso con ají
Porque así me gusta a mí

Yo me lo como con ají
Me lo paso con ají
Porque así me gusta a mí

Y fiesta y rumba
Y rumba que es la feria de la caña
Y fiesta y rumba
Y rumba que es la feria de la caña

Esto es cuestión de pandebono
Esto es cuestión de pandebono
Esto es cuestión de pandebono
Esto es cuestión de

Y fiesta y rumba
Y rumba que es la feria de la caña
Y fiesta y rumba
Y rumba que es la feria de la caña

Y fiesta y rumba
Y rumba que es la feria de la caña
Y fiesta y rumba
Y rumba que es la feria de la caña

Esto es cuestión de pandebono
Esto es cuestión de pandebono
Esto es cuestión de pandebono
Esto es cuestión de

Si por la quinta vas pasando
Es mi Cali bella que vas atravesando
Si por la tarde las palmeras se mueven alegres
La noche está esperando fiesta"
Salsa,Grupo Niche,De Amor Nadie Se Muere,"si acaso nuestro amor de nuevo fracasara
tu sabes que seria lo peor que nos pasara
lo que hubo entre los dos
no se hizo en el momento
a ti no te compre.. por eso no te vendo

tuuuuu tristemente tuuu me dijiste cuando me aleje
que de amor ya no se muere
mas muriendo me marche
pero estoy aqui tras un año eh comprendido quee
sin amor ya no se muere
yo sin ti no vivire

abrazame tambien no importa que nos vean
si sabes que me hace tanto bien quizas comprendas
que se han de aprovechar todos los minutos
despues nos faltaran si no vivimos juntos

tuuuuuu tristemente tuuuuu
me dijiste cuando me alejeee
que de amor ya no se muere
mas de amor me marche
pero estoy aqui tras un año
eh comprendido que
si de amor ya no se muere yo sin no ti vivire

si de amor ya no se muere
yo sin ti no vivire
te fuiste por que quisiste y ahora yo no se que hacer
si de amor ya no se muere
yo sin ti no vivire
triste estoy triste me quede
si de amor ya no se muere yo sin ti no vivire
me tienes temblando sufriendo y llorando
hoy quiero volverte a ver

ya no se muere... hay dioss
ya no se muere por amor
te entregue toda mi vida te entregue mi corazon
ya no se muere que no que no
ya no se muere por amor
cuanto tienes cuanto vales eso me pregunto yo
ya no s emuere
no hoy no
ya no se muere por amor ayayay
que dolor que me da
ya no se muere (X5)
ya no s emuere por amor"
Salsa,Grupo Niche,Faltó Un Pañuelo,"Ese día que tú te olvidaste de mí
Ese día que yo, ay, me olvidé de ti
Faltó un pañuelo para secar tus lágrimas
Faltó un amigo que me consolará
Faltó un pañuelo para secar tus lágrimas
Faltó un amigo que me consolará
(2x)

Hubo testigos, demasiados testigos,
Que te vieron con él, que me vieron con ella
Hubo testigos, demasiados testigos,
Que te vieron con él, que me vieron con ella

Faltó un pañuelo para secar tus lágrimas
Faltó un amigo que me consolará
Faltó un pañuelo para secar tus lágrimas
Faltó un amigo que me consolará

Y la pobre mujer que conmigo estaba,
Mientras él te besaba, ya me besaba,
Y por dentro por dios que la traicionaba,
Pues contigo mi corazón soñaba
Y esa pobre mujer que conmigo estaba,
Mientras él te besaba, ya me besaba,
Y por dentro por dios que la traicionaba
Sólo por ti, por ti, mi corazón lloraba

(faltó un pañuelo para secar tus lágrimas
Faltó un amigo que me consolará)

(faltó un pañuelo, ay, faltó un amigo)
¡ay! para secar tus lágrimas
Y el hombro de un amigo que a mí
Me pueda consolar
(faltó un pañuelo, ay, faltó un amigo)
Me dolió, sí, mucho me dolió
Y ahora qué hacer cuando sin ti vuelva a amanecer
(faltó un pañuelo, ay, faltó un amigo)
Tu risa, tus besos y tu dulzura
Qué tragedia que este amor terminará en amargura
(faltó un pañuelo para secar tus lágrimas
Faltó un amigo que me consolará)

¡agua, agua!
(faltó un pañuelo, faltó un amigo)
Esa tristeza que tengo
(faltaste tú también)
Por qué, por qué, por qué, por qué
(y tu cariño)
¿por qué conmigo no estás?
(faltó un pañuelo, faltó un amigo)
Mamá, mamacita, ya yo no puedo dormir
(faltaste tú también)
Dime por qué, dime por qué, dime por qué el destino
(y tu cariño)
Mí no todo ha confundí
(faltó un pañuelo, faltó un amigo)
Ay, no me deje solo
Que yo no sé, yo no sé, yo no sé, yo no sé
(faltaste tú también)
Ay, yo no sé sin ti vivir ¡no sé!
(y tu cariño)

¡glu! ¡agua!"
Salsa,Grupo Niche,Un Alto En El Camino,"Para poder seguir
un alto en el camino quise hacer
un instante mi vida detener
una duda en la noche esclarecer.

Para poder seguir
el beso que no dí aquella vez,
la mano que yo no pude extender,
todo eso y mucho más 
quisiera devolver.

Para poder seguir, 
para poder seguir será importante
poner a paz y salvo mi conciencia
el bien por encima de todo como esencia.

Para poder seguir,
para poder seguir y que me atiendan,
seré yo luz, como faro referencia,
mejoraré la letra para que me entiendan.

Para poder seguir habran razones
seré esclavo de todas mis convicciones
repartiré mi pan en iguales proporciones.

Para poder seguir habrá un motivo,
que no tenga que ver nada con el olvido,
sin un pasado no diría que he vivido.

Coro

Así me toque arrancar de ceros,
seré un hombre más pero sincero

Pregones

Seré como el acero, seré, seré como el hombre que da todo
porque se siente entero.

Ésta es mi poesía y sigo siendo fiel a mi filosofía.

Un libro abierto soy un libro abierto, 
mi corazón al descubierto.

Así me toque arrancar de ceros,
así me toque arrancar de nuevo.

Seré, seré, seré, seré,
amor seré, eso es lo que yo daré.

Mejoraré la letra para que m entiendan,
mejoraré la letra para que me entiendan,
digo que mejoraré."
Salsa,Grupo Niche,Que nunca me falte tu amor,"Nada mas cierto que tu, nada...
Ni siquiera el agua que bebo
Para calmar mi sed,
Ni el aire que respiro
N la noche ni el día

Nada mas cierto que tu
Y por eso....

Que nunca me falte tu amor, que nunca me falte
Nada seria de mi, si llegas a olvidarme
Que nunca me falte tu amor, que nunca me falte
Por que moriría en soledad si dejas de amarme eh,eh,ehhh...

Nada me llena mas, que tu presencia
En las horas que paso junto a ti, en tu entrega
Ni los sueños en el alma, ni el ahora ni el mañana
Nada me llena mas y por eso...

Que nunca me falte tu amor, que nunca me falte
Por que mi todo esta compuesto por tus partes
Que nunca me falte tu amor, que nunca me falte
Por que moriría en soledad si dejas de amarme eh,eh,ehhh...

Que nunca me falte tu amor, que nunca me falte
Por que moriría en soledad una vez y otra vez
Si tu me dejas de amar mujer...

Que nunca me falte tu amor,
(ay por favor no,no,no)
que nunca me falte

mi vida es un barco a la deriva,
si no te tengo a mi lado
Que nunca me falte tu amor,
(no me dejes naufragar)
que nunca me falte

sin ti la vida no tiene sentido
y es que el sol no brilla si no estas conmigo
Que nunca me falte tu amor,
(tu eres mi razón de ser)
que nunca me falte

no me dejes,,,que la soledad es cruel
y parte el alma....
Que nunca me falte tu amor,
( y la destroza sin piedad)
que nunca me falte
que nunca, que nunca,
que nunca me falte tu amor...
que nunca me falte el corazón...

que nunca me falte, que nunca me falte...

Que nunca me falte tu amor,
que nunca me falte
quiero gritar y que lo sepa quien lo sepa
que eres la llama que enciende mi hoguera

Que nunca me falte tu amor,
(solo eres tu...)
que nunca me falte

eres el aire que respiro
la fuente que me da vida
el amor hecho a mi medida

Que nunca me falte tu amor,
(y por favor...)
que nunca me falte
si te vas ay!!! no me digas adiós
por que moriría de dolor el corazón."
Salsa,Grupo Niche,Sin palabras,"Si no hay cariño
si ya no hay horas, minutos segundos
para estar cerca de tí
no existe la idea, la más mínima idea
de lo que es el amor.

Si ya no hay risa, solo el llanto que avisa
que somos dos más que caminan sin rumbo,
sin lugar a donde ir,
no existe la idea, la más mínima idea
de lo que es el amor.

Las palabras están hechas
y no se pueden expresar
porque como actuamos no es la forma más usual
no existe lo casual, el detalle más formal
un lecho que duerme sin la paz de tu ideal.

Las palabras están hechas
y no, y no podemos expresar
porque como actuamos no es la forma más usual
no existe lo casual, el detalle más formal
un lecho que duerme sin la paz de tu ideal.

Coro 1

El amor es lo que nosotros pensamos y algo más
pero cuando nos maltratamos no, no sabemos dónde va.

Pregones

Ayer que tú que yo la cosa queriendo,
más tarde sin un porque peleando
con la mano izquieda dando,
con la derecha mamíta castigando.

No sabemos dónde va
o depronto con quién está
árido se volió el terreno,
no hay quién pueda otra vez sembrar,
se acabó el abono.

Coro 2

La gente dice que tú estás por ahí llorando
la gente dice que yo estoy por aquí riendo.

Pregones

Riendo de qué si el error no perdoné
saca cuentas no equivoques,
paga lo que me debés,
pero, pero, pero de una vez.

La experiencia hace al maestro
y la calle al desenvuelto
las palabras son recuento,
lo demás es puro cuento."
Salsa,Grupo Niche,Corazon sin corazon,"Me cansé de rogarte que fueras algo en mi vida
Que adorarte por siempre justificaría
Un puñado de penas que al fin terminaría
Y una más le sumaste sin ver que por ti moría

Y mi corazón batalló
Y mi corazón esperó
Pero nunca correspondió
La pasión con la cual lucho

Y mi corazón batalló
Y mi corazón esperó
Tanto, tanto tiempo pasó
Que mi corazón se cansó

De azul me pintabas el cielo ay me engañabas
Pues la tarde gris cada vez más todo negaba
Y yo como un tonto de ti solo esperaba
Que tu corazón alguna vez por mí se enfermara

Y mi corazón batalló
Y mi corazón esperó
Pero nunca correspondió
La pasión con la cual lucho

Y mi corazón batalló
Y mi corazón esperó
Tanto, tanto tiempo pasó
Que mi corazón se cansó

Y reíste al verme sufrir y tu amor vendías
Al mejor postor y saber que más tarde un día
Poco a poco los años de ti no se condolían
Implacable frío y miseria te convertía

Y mi corazón batalló
Y mi corazón esperó
Pero nunca correspondió
La pasión con la cual lucho

Y mi corazón batalló
Y mi corazón esperó
Tanto, tanto tiempo pasó
Que mi corazón se cansó

Corazón que no tiene corazón
Tampoco tiene perdón de Dios

Corazón que no tiene corazón
Tampoco tiene perdón de Dios

Llora por siempre, llora corazón
Con lágrimas de sangre paga tu traición

Corazón que no tiene corazón
Tampoco tiene perdón de Dios

No tienes no no no tienes no
Pero no tienes, no tienes corazón ni Dios

Corazón que no tiene corazón
Tampoco tiene perdón de Dios

Llora, llora corazón
Corazón llora

Corazón que no tiene corazón
Tampoco tiene perdón de Dios

Te conocí a los veintidós
Ahora con treinta aparenta cincuenta y dos

Corazón que no tiene corazón
Tampoco tiene perdón de Dios

No, no, no me duele que me hayas herido
La verdad es que soy feliz de haberte perdido

Corazón que no tiene corazón
Tampoco tiene perdón de Dios

Todo lo que brilla no es oro
Por salir de pobre me engañaste con el cobre

Corazón que no tiene corazón
Tampoco tiene perdón de Dios

Mi vida fue feliz hasta que tú
Apareciste en ella y la volviste un cucu

No tienes corazón
Tampoco mi perdón

No tienes corazón
Tampoco mi perdón

No tienes corazón
Tampoco mi perdón

No tienes corazón
Tampoco mi perdón

No tienes corazón

No tienes corazón
Tampoco mi perdón

No tienes corazón
Tampoco mi perdón

No tienes corazón
Tampoco mi perdón

No tienes corazón
Tampoco mi perdón

No tienes corazón"
Salsa,Grupo Niche,Digo yo,"ORQUESTA
( Digo yo el santo que no me quiera
que no me preste favores
que mala cara me ponga
tampoco yo le prendo velas
Digo yo con tal que de mi te alejes
me arrodillo hasta que dejes
mi vida en paz mi vida alegre
hay yo me rezo (lo que quieras/ cuando pueda   2v)
( UN ALAVAO PA QUIEN ME QUIERA EN ESTA SALVE MI CORO ALAVAO  2v)
	ORQUESTA

( UN ALAVAO PA QUIEN ME QUIERA EN ESTA SALVE MI CORO ALAVAO  2v)
Pá quien no me quiera, así la gracia no me haya dáo
-Y alavao (4v), yo tengo mi santo paráo
-Al saber le dicen suerte, sigue viviendo engañáo
-Ahí paraito nada má comay, ahí paraito nada má
	-	
ORQUESTA
UN ALAVAO PA QUIEN ME QUIERA EN ESTA SALVE MI CORO ALAVAO

PIANO 2v)
                                 TROMPETAS       /////      PIANO //
UN ALAVAO PA QUIEN ME QUIERA EN ESTA SALVE MI CORO ALAVAO

( ALAVAO HE HE OH HE HE OH HE HE   2V)
QUE SI ME QUIERE… PÁ ADENTRO
SI NO ME QUIERE… PÁ AFUERA
QUE SI ME QUIERE… PÁ ADENTRO
SI NO ME QUIERE… PÁ AFUERA OTRA VEZ

( ALAVAO HE HE OH HE HE OH HE HE   2V)
QUE SI ME QUIERE… siga, siga, siga, siga
SI NO ME QUIERE… PÁ AFUERA OTRA VEZ

( ALAVAO HE HE OH HE HE OH HE HE   2V)

ORQUESTA

UN ALAVAO PA QUIEN ME QUIERA EN ESTA SALVE MI CORO ALAVAO"
Salsa,Grupo Niche,Maldita forma de querer,"Amaneci un nuevo dia lleno de tormentos
solo me voy caminando con mi pensamiento
no me importa si es que es tarde si esta haciendo frio
solo se que tu recuerdo borrar no consigo

sigue la lluvia cayendo y mojando mi pecho
impaciente yo mirando como cambia el tiempo

y sufro porque no me quieres
y sufro porque yo te amo
y sufro porque todos saben que tu amor me hiere

maldita forma de querer
maldita forma de soñar
malditos besos de mujer
que me llevaron a pensar
mi amor que da de corazon
como es que yo senti vivir
y me averguenzo de las lagrimas
que llore por ti...

tu recuerdo me persigue a todo momento
ya no se si es que estoy soñando si es que estoy despierto

tan solo se que no me quieres
tan solo se que yo te amo
tan solo se que estoy sintiendo que tu amor me hiere

maldita forma de querer
maldita forma de soñar
malditos besos de mujer
que me llenaron de placer
por ti yo pude enloquecer
por ti yo pude comprender
que en solo sueño, solo sueños
el amor es miel

(que forma de querer malditos besos saben a ayer)
malditos besos que me han embrujado y ahora sin ti no se que hacer
(que forma de querer malditos besos saben a ayer)
y es que esta forma de querer me obliga a recordarte mujer
(que forma de querer malditos besos saben a ayer)

(que forma de querer malditos besos saben a ayer)
pero como he de borrar este recuerdo que me sigue y me ha hecho tanto daño
(que forma de querer malditos besos saben a ayer)
sigo sañondo soy feliz, para que despertar y no hallarte"
Salsa,Grupo Niche,La Magia de Tus Besos,"Si me besas en la boca, ternura
Si me besas al amanacer
Si me besas, ya no queda duda
Que nuestro amor es tan grande como el mar

En tus labios rojos solo hay dulzura
Y un camino a la felicidad
Entre paredes rosadas, un sueño
Que no quisiera nunca despertar

La magia de tus besos
Me tienen como loco
Me tienen como un tonto
Que ya no sé qué hacer

La magia de tus besos
Son mi único tesoro
Es lo que más adoro
No te voy a perder

En mi cuarto solo frente al nochero
Un pensamiento en la oscuridad
La tristeza que se mete en mi cuerpo
Porque sucede siempre cuando tú no estás

En el cielo ya no quedan nubes
El horizonte está en la inmensidad
Así de grande como lo que yo siento
Ahora ya sé que de mí nunca te irás

La magia de tus besos
Me tienen como loco
Me tienen como un tonto
Que ya no sé qué hacer

La magia de tus besos
Son mi único tesoro
Es lo que más adoro
No te voy a perder

(Yo tengo la llave de tu corazón
Entro por la noche, salgo con el sol)
Tú, tú, tú no sabes cuánto me duele cariño
Cuando no estás conmigo

(Yo tengo la llave de tu corazón
Entro por la noche, salgo con el sol)
Y esto es cosa de todos los días
Me haces vivir esta increíble fantasía

(Yo tengo la llave de tu corazón
Entro por la noche, salgo con el sol)
Quererte es lo más bello que ha podido suceder
En la existencia de mi vida

(Yo tengo la llave de tu corazón) yo
(Entro por la noche, salgo con el sol)
Yo tengo la llave, yo tengo la llave, yo tengo la llave
Yo tengo tu corazón en mi clave

(Yo tengo la llave de tu corazón)
Si voy a buscarte no le cambies seguro a la chapa
(Yo tengo la llave de tu corazón)
Que si no puedo abrir la puerta de pronto el frío me mata

(Yo tengo la llave de tu corazón)
Yo tengo, la tengo, y a buscarte vengo
(Yo tengo la llave de tu corazón)
Caliéntame con besos que yo no me enojo por eso"
