Genero,Artista,Titulo,Cancion
Salsa,La India,Traicion,"Lo nuestro no es una camisa de fuerza
es blanco o es negro de agua o de piedra
es un mandamiento callado de darnos amor sin cadenas
nadie te trajo obligado y siempre la puerta esta abierta
no es una condena a cadena perpetua
es pacto de fe que se cuida o se quiebra
si un dia se me va tu mirada no sere de tus ojos la venda
si te ves fugitivo y cautivo se sincero y dare media vuelta

Traicion es la palabra que no puede comprender mi alma
traicion es el puñal cobarde y cruel que ataca por la espalda
traicion, si juegas con esta mujer ya pagaras tu karma
traicion, no corro el riesgo de cruzar mi fe sobre esa trampa
traicion, sabe muy bien lo que se romper un corazon
si un dia la duda te convence y me derrota
se valiente ven de frente la traicion siempre se ve
la traicion siempre se nota

No quiero migajas, te quiero completo
virtudes y errores mi buen amuleto que nunca nos sobre el motivo, la clara
mirada de amigos
la boca en lo justo y lo cierto,
sanando a este mundo imperfecto

Traicion es la palabra que no puede comprender mi alma
traicion es el puñal cobarde y cruel que ataca por la espalda
traicion, si juegas con esta mujer ya pagaras tu karma
traicion, no corro el riesgo de cruzar mi fe sobre esa trampa
traicion, sabe muy bien lo que se romper un corazon
si un dia la duda te convence y me derrota
se valiente ven de frente la traicion siempre se ve
la traicion siempre se nota

(sabe muy bien lo que se romper un corazon la traicion siempre se nota)
sabe muy bien lo que se romper un corazon lo tuyo es traicion
(sabe muy bien lo que se romper un corazon la traicion siempre se nota)
gracias a dios me libre de ti ahora soy feliz
ahora que te cuentras solo sin mi
extrañaras mi querer ya no te siento como ayer
lo nuestro termino.... te digo adios....
(ya pagaras tu karma si juegas con esta mujer)
si juegas con esta mujer, porque tu eres mentiroso, caprichoso, eres infiel
(ya pagaras tu karma si juegas con esta mujer)
yo se que pagaras y te arrepentiras un dia sufriras,
no quiero verte mas, jamas
traicionero, hechichero, no mas traicion...."
Salsa,La India,Ya no queda nada (tito jam tito nieves nicky jam y la india),"Tito:
He perdido todo y ya no tengo nada,
lo unico que yo hice fue quererte
ahora me hechas por la ventana
y nisiquiera me miras de frente
esque de este amor ya no queda nada
ahora tu vas a saber lo que se siente
amar a alguien que no te ama
que alegria que te arrepientes.

La india:ya, ya, yaaa,
ya no hay nada que decir
admitelo, lo nuestro se acabo y no fui yo
quien te fallo
anda si te kieres ir
arrancalo
da media vuelta comungelo
yo no me voy a morir
tengo que seguir

La india:
tu sabes que esta nena no te quiere pa na
lo mio es pichineo fuerte
y basilon nada mas
lo que paso paso
ahora no vengas a rogar pa aca
y a llorar como eternidad
dale sacude muevete
yo me voy pa la calle
tu quieres que te tubre
yo me voy pa la calle
que tu a mi no hables
lo mio es hanqueal
a de ti te coge
no hay mas que hablar.

tito:
He perdido todo y ya no tengo nada
lo unico que yo hice fue quererte
ahora me hechas por la ventana
y nisiquiera me miras de frente
esque de este amor ya no queda nada
ahora tu vas a saber lo que se siente
amar a alguien que no te ama
que alegria que te arrepientes.
Nicky:
Oh yeah
yo soy nicky jam
con una tipa como tu yo no puedo estar tengo gatas que me sobran en la sociedad
me vieron contigo
ahora tengo mira que pichar
lo de divertir mami eso se acabo
lo de andar en limusina
eso se acabo
tengo que meter la fila cuando yo estoy
yo sigo caminando con el flow yeah cabron
ese es nicky, nicky jam dice y lo digo.

tito:
He perdido todo y ya no tengo nada
lo unico mque yo hice fue quererte
ahora me hechas por la ventana
y nisiquiera me miras de frente
esque de este amor ya no queda nada
ahora tu vas a saber lo que se siente
amarn a alguien que no te ama
que alegria que te arrepientes.

de este amor no queda nada
en un tiempo quise tenerte
nada, nada, nada.
la india:
no quiero verte.
nicky:
con una tipa como, tu yo no puedo estar
tito y la india:
no queda, no queda, no queda nada.
la india:
estamil y la india pa.
nicky:
noriegaaaaa
la india:
helgio
nicky:
reggae, reggae, reggaeton pana
dale nicky jam you
ya tu sabes como va digo.
tito:
de este amor ya no queda nada
tito y a india:
no queda, no queda, no queda nada
tito:
de este amor no queda nada.
jajajaja...."
Salsa,La India,Ella o Yo,"El amor que tu me das 
Es poco pero en fin 
Me conformo con creer 
Que soy feliz 
Y te tengo que querer 
Sintiendo que este amor 
Se quedo anos atras 
Que no existio 

Que dificil es 
Vivir con desamor 
Te quedas o te vas 
Para ti quien soy 
No podemos segurir diciendonos 
Frases vasias 
No podemos seguir mintiendonos 
O ella o yo 

El amor que tu me das 
Es como un dia gris 
Aunque te quedas corazon 
No te siento aqui 
En el juego del amor 
Las cosas son asi 
Otro puso otra mujer 
Y un mal feliz 

Que dificil es 
Vivir con desamor 
Te quedas o te vas 
Para ti quien soy 
No podemos segurir diciendonos 
Frases vasias 
No podemos seguir mintiendonos 
O ella o yo 

No podemos seguir mintiendonos 
O ella o yo 
Que dificil es 
Vivir con desamor 
Porque no dices la verdad 
No podemos seguir mintiendonos
O ella o yo 
El amor que tu me das
No da para nada 
Por que tienes otra amada 
No podemos seguir mintiendonos
O ella o yo 
No jueges con mi sentimientos 
Eres frio como el viento 
Tu no tienes corazon 
No podemos seguir mintiendonos
O ella o yo 
Oh no 
O ella o yo 
Oh no 
Oh 
Oh 
Decidete 
O ella o yo 
Decidete
Decidete 
O ella o yo
O ella o yo 
Decidete 
Decidete 
O ella o yo 
Para ti quien soy 
Decidete 
Ya termino 
O ella o yo
Este juego de amor
Decidete 
Decidete 

O ella o yo
Oh no 
Oh 
Oh 
O ella o yo
O ella o yo 
Decidete
Decidete 
Oh

O ella o yo
Eso fue solo un querer 
Decidete 
Tu no puedes entender 
O ella o yo 
Asi no se quiere una mujer 
Decidete 
Oh no 
O ella o yo 
Oh 
Decidete 
O ella o yo 

O ella o yo 
Decidete 
Decidete 
O ella o yo 

O ella o yo 
Decidete
O ella o yo 
Ohh 
Decidete"
Salsa,La India,I Just Want To Hang Around You,"Yo no puedo resistir
Lo que me haces sentir
Yo quiero amarte nada mas
Solo a ti
Por que tu forma de querer y tu manera de ser
Quiero decirte que ya comprendi
Que te amo
Solamente a ti

I just want to hang around you
Every day and night
All of my life around you
Hang around you baby
I just want to hang around you
Everyday and night
All of my life around you
Hang around you

I get so hypnotized
When I look in your eyes
Hold me close
Hold me

I get butterflies
When I'm right here by your side
I need your touch
Can't get enough
Love me
All you got to see is

Quiero siempre estar contigo
Enamorados tu y yo
Enamorados tu y yo
Junto a ti yo quiero estar contigo
Siempre
Siempre contigo

Quiero siempre estar contigo
Enamorados tu y yo
Enamorados tu y yo
Junto a ti yo quiero estar contigo
Siempre contigo
Spending every moment of my life
Within your gaze
Your forever love
To have you and to hold you
So you never ever need your crystal ball to know where I'll be
Always stay around you boy
Around you boy
Oh
I just want to hang around you
Hang around you
All night babe
Ah holding you tight

I just want to hang around you
I just want to hang around you boy
Every night
Every day
Till the morning
All night babe

Yo Serg
Get funky now

Come on
Come on
I just want to hang around you
I wanna hang around you
And love and hold and squeeze you all the time
All the morning light

Yo quiero estar contigo
Contigo baby
Amandote
Tu y yo
Yo quiero estar
Yo quiero estar
Contigo
Contigo
Oh
Siempre
Siempre
Yo quiero estar
Contigo
Contigo
Oh
Siempre
Siempre
Oh
Yo quiero estar
Yo quiero estar
Contigo
Contigo
Oh
Siempre
Siempre

You
Because I want you baby
Oh"
Salsa,La India,Madre e Hija,"Madre fueron nueve meses 
que estuve en tu vientre 
y naci de ti... 
Madre gracias por la vida 
por las cosas lindas 
que aprendi de tì.. 

El aliento y el calor de tu cariño 
no se puede comparar 
los momentos mas amargos que he vivido 
con tu ayuda yo los pude superar... 

Madre solo existe una, 
como el sol y la luna 
eres mi vida y mi luz. 
Oooh Oooh 
Madre,siemprè ten presente 
te amarè hasta el dia de mi muerte 
no hay nadie como tù... 

Hija siempre en l distàcia 
yo te recordaba y pensaba en tì 
Esè tiempo que pasamos tan ditante 
no los quiero recordar... 
los momentos mas amargos que vivimos 
nuestro siempre los pudo superar 

Hija solo existe una 
como el sol y la luna 
eres mi vida y mi luz 
Madre siempre tèn presente 
que te amarè hasta el dia de mi muerte 
no hay nadie como tù 
Como tù como tu 
como tù como tù 

Madre mia no hay nadie como tù 

Siemprè presente(x2) 
Estas en mi mente (x2) 

Madre mia no hay nadie como tù 

Nadie podra separarnos 
nadie, 
habra espacio para amarnos 
madre mia no hay nadie como tu"
Salsa,La India,Que Te Pedi,"Que te pedi, que no fuera leal comprension,
Que supieras que no hay en la vida
Otro amor como mi amor.
Que no te di,
Que pudiera en tus manos poner
Que aunque quise robarme la luz para ti,
No pudo ser.
Hoy pides tu,
Las estrellas y el sol, no soy un dios,
Asi como soy, yo te ofresco mi amor, no tengo mas,
Pide, lo que yo puedo darte, no me importa
Entregarme a ti sin condicion.
Pero que te pedi, tu lo puedes al mudo decir,
Que supieras que no hay en la vida otro amor
Como mi amor."
Salsa,La India,Si Estuvieras Aquí,"Si estuvieras aquí....
Si supieras
Que cuando no estás a mi lado
Cada momento cada hora
pienso en tí
Cierro mis ojos y estás presente en mí
Lo que daría hoy en día si fueras mío.
¡Ay! Yo no sé que voy a hacer con lo que siento
Ya es muy tarde lo comprendo
Ahora sé que hay sentimiento por tí...
Dame una razón para yo dejarte y no amarte
Dame una razón por que ya no puedo olvidarte.
Pero dame una razón para que
mañana no rechases mi amor....
Si estuvieras aquí, aquí conmigo
Si el cielo y el mar pudiera unirnos
Serías dueño de mí, y mi cariño
Fuera un regalo de Diós para los dos
Si estuvieras aquñ...
No quisiera que entre nosotros terminara
Una amistad que se ha tornado en una relación
Si de repente estás con otra
No lo digas por favor
que prefiero no saber de tu querer.
¡Ay! Yo no sé que voy a hacer con lo que siento
Y es muy tarde, lo comprendo
Ahora sé que hay sentimiento por tí
¡Ay No!
Dame una razón para yo dejarte y no amarte
Dame una razón por que ya no puedo olvidarte.
Dame una razón para que mañana
no rechases mi amor....
Si estuvieras aquí, aquí conmigo
Si supieras que yo a tí te quiero
Me entragarías a mí tu corazón
Todo tu amor y pasión sin condición.
Si estuvieras aquí, aquí conmigo
Si el ciel y el mar pudiera unirnos
Serías dueño de mí, y mi cariño
Fuera un regalo de Diós para los dos
Si estuvieras aquí....
Si estuvieras aquí...."
Salsa,La India,Si Tu Eres Mi Hombre,"Si Tu Eres Mi Hombre 

Pregúntale a la noche 
Si ha visto alguna vez 
Dos pieles abrazándose 
En una misma piel 

Mi cuerpo es casi tuyo 
Tu cuerpo es casi yo 
Dos islas que se buscan 
Entre la niebla de las dos 

Si tú eres mi hombre 
Y yo tu mujer 
Dondequiera que estés, amor 
Contigo estaré 

Porque el sol puede mentir 
Porque el mar puede engañar 
Todo puede ser mentira 
Pero nosotros somos verdad 

Si tú eres mi hombre 
Y yo tu mujer 
Dondequiera que estés, amor 
Contigo estaré 

Lejana o cercana 
Tú lo quieras o no 
No hay muerte en el mundo que consiga matar 
Una historia de amor 

La vida nos lo pide 
Nos lo pide el corazón 
Mi estrella es toda tuya 
Tu estrella es toda yo 

Si tú eres mi hombre 
Y yo tu mujer 
Dondequiera que estés, amor 
Contigo estaré 

Lejana o cercana 
Tú lo quieras o no 
No hay muerte en el mundo que consiga matar 
Una historia de amor 

Lejana o cercana 
Tú lo quieras o no 
No hay muerte en el mundo que consiga matar 
Una historia de amor"
Salsa,La India,Solamente Una Noche,"Solamente una noche... 

Me estas mirando 
y siento que me quieres provocar. 
Que estas pensando? 
Ni te imagines que me vas a enamorar. 

Vive el momento 
que no podrás tener para siempre. 
Después de hoy voy a borrarte de mi mente, 
ya lo verás. 

Solamente una noche 
y nada más. 
Solamente una noche 
después te vas. 

Sin que existan promesas, 
compromisos ni amarras 
porque soy como el viento 
que nunca podrás atrapar. 
Esto no durará. 

No pierdas tiempo 
y llévame contigo a ese lugar. 
No sé tu nombre... 
Que importa lo que digas o lo obviaras 

Siente mi cuerpo 
que ya mañana no estaré. 
Es ahora o nunca. 
Quiero ser tuya sin reproches ni preguntas. 
Ámame ya! 

Solamente una noche 
y nada más. 
Solamente una noche 
después te vas. 

Sin que existan promesas, 
compromisos ni amarras 
porque soy como el viento 
que nunca podrás atrapar. 
Esto no durará."
Salsa,La India,Cuando hieres a una mujer,"Usted no sabe nada 
que mis pasos siguen huellas, 
y mis frases dejan besos 
que no pueden comprenderla 
el roce de sus manos,sus ojos 
fueron viento,dibujandome el paisaje 
que retrata el pensamiento 

Hay otros datos que confunden mis deseos 
ser infiel no es lo que quiero 
ya no quiero tu verdad. 

(Coro) 
(Cuando hieres a una mujer,no perdona) 
te olvida para siemprè noste borra de tu mente 
(Cuando hieres a una mujer,no perdona) 
Quedaste en el pasado,muy triste y lastimado 

Es que me desespero,y te busco mas que nunca 
hoy extraño hasta los sueños,esè fuego de tu cuerpo 
tù nombre es el camino,un recuerdo a la memoria 
que perdì hace mucho tiempo,ya lo nuestro es historia 

Hay otros labios que confunden mis deseos 
ser infiel no es lo qe quiero 
yo no quiero tu verdad 

(Cuando hieres a una mujer,no perdona) 
te olvida para siemprè no se borra de tu mente 
(Cuando hieres a una mujer,no perdona) 
Quedaste en el pasado,muy triste y lastimado 
Cuando hieres a una mujer,no perdona) 
te olvida para siemprè no se borra de tu mente 
(Cuando hieres a una mujer,no perdona) 
Quedaste en el pasado,muy triste y lastimado 

(Ivy Queen) 
Cuando hiere a una mujer 
Tiene venganza sin remedio 
preparate para sufrir mentiroso 
como tu pensabas que serìa facil engañarme 
y burlarte asì de mì,todo te lo di 
tus mentiras creia,aunque muera de amor 
no quiero saber de tì porque eres 
malo,malo,malo,yo estaba loca 
tantos sueños a tu lado y todo el tiempo 
que tu me has quitado,no quiero mas saber mas de ti 
mentiroso. 

Una mas que se anotà 
una mas 
Esà es la India y la Caballota,la potra 
dale,dale 

(Ivy Queen) 

Preparate para sufrir mentiroso mentiroso 
como tu pensabas,como,como tu pensabas 
engañarme y burlarte asì de mi 
yo estaba loca tantos sueño a tu lado 
yo estaba loca tantos sueño a tu lado 
no quiero saber de ti 
(India) 
Quedaste en el pasado,muy triste y lastimado 
Una mas que se anotà 
Esà es la India y la Caballota,la potra"
Salsa,La India,Dejame Volver Contigo,"Dejame volver,volver contigo 
no hay trucos ni juegos de palabras
y es que no encontre otra forma mas sincera de decir

Dejame volver, volver contigo
ya no puedo soportar serenamente el futuro ni el
presente sin ti

Dejame volver ,volver contigo
ya lo se ahora estas con esa
pero todo el mundo sabe que no es nada para ti.

Sere ,tu amante ,una princesa quien sea
sere,lo que me pidas tu
amor,lo digo muy de veras ,
haz conmigo lo que quieras,
reyna,esclava o mujer
pero dejame volver,volver contigo

Dejame volver contigoo..... 

CORO:DEJAME VOLVER,QUIERO VOLVER CONTIGO 

Ay dejame volver contigo,dame otra oportunidad para darte felicidad.
CORO:DEJAME VOLVER,QUIERO VOLVER CONTIGO 
Yo quiero estar contigo,ay estar en tu camino 
CORO:DEJAME VOLVER,QUIERO VOLVER CONTIGO 
Yo no puedo soportar serenamente,
el futuro ni el presente sin ti
CORO:DEJAME VOLVER,QUIERO VOLVER CONTIGO 
Ay dejame volver contigo,
que te necesito a mi lado
CORO:DEJAME VOLVER,QUIERO VOLVER CONTIGO
Esa mujer no te puede amar
como te amo yo ,como te quiero yooo....
Como te quiero yoooo
CORO:SERE ,SERE LO QUE PIDAS TU ,TU REYNA ,TU ESCLAVA
Y MUJER SERE
Sere ,sere,sere
CORO:SERE ,SERE LO QUE PIDAS TU ,TU REYNA ,TU ESCLAVA Y MUJER SERE
No hay trucos ni juegos de palabras,que decidan lo que siento
CORO:SERE ,SERE LO QUE PIDAS TU ,TU REYNA ,TU ESCLAVA Y MUJER SERE
Sere lo que quieras,hare lo que quieras 
CORO:SERE ,SERE LO QUE PIDAS TU ,TU REYNA ,TU ESCLAVA Y MUJER SERE 
Sere tu reyna ,tu esclava ,tu amiga ,pero dejame volver............"
Salsa,La India,Hielo,"Mira, es mejor que lo sepas de una vez 
todo lo que ves como ya sabes 
es fingido, es comedia 
es una escena para ti 

Mira, yo no quiero herirte corazon 
pero todos mis sentidos quieren mas 
son mentiras, son por miedo 
son una farsa, un engaño solo eso..... 

Y todo lo que siento es Hielo 
en cada palmo de mi piel 
en cada gesto de amor 
en cada pelo 

Lo unico que siento es Hielo 
en cada beso que me das 
y no lo puedo evitar 
por mas que intento 
lo unico que siento es Hielo 
y nada mas...........nada mas 

Mira, no quiero que pienses mal de mi 
y yo te soy completamente fiel 
no lo dudes, y te respeto 
eso es aparte coorazon 

Mira, no te dire nada nunca mas 
tu vas a tenerme para ti 
a tu lado, hasta siempre 
es que no podia mas, tenias que saber mi amor..... 

Que todo lo que siento es Hielo 
en cada palmo de mi piel 
en cada gesto de amor 
en cada pelo 

Lo unico que siento es Hielo 
en cada beso que me das 
y no lo puedo evitar 
por mas que intento 
lo unico que siento es Hielo 
y nada mas 

CORO: LO UNICO QUE SIENTO ES HIELO 

En cada palmo de mi piel 

CORO: HIELO 

En cada gesto de amor, en cada pelo 

CORO: LO UNICO QUE SIENTO ES HIELO 

Aunque te soy completamente fiel 

CORO: HIELO 

Ya no lo puedo evitar por mas que intento 

CORO: LO UNICO QUE SIENTO ES HIELO 

Cada beso que me das, es fingido, es comedia 

CORO: HIELO 

Y es que no podia mas y tenias que saberlo....OH OH OH 

CORO: NO QUIERO HERIRTE CORAZON, NO QUIERO HERIRTE 

Quiero decirte la verdad, contigo estoy muy triste 

CORO: NO QUIERO HERIRTE CORAZON, NO QUIERO HERIRTE 

Ay no no, no quiero herirte, no no quiero 
herirte.......no no no no 

CORO: NO QUIERO HERIRTE CORAZON, NO QUIERO HERIRTE 

No quiero que te sientas mal, pero ya contigo no puedo estar 

CORO: NO QUIERO HERIRTE CORAZON, NO QUIERO HERIRTE 

Tantas noches llorando por ti 
sintiendome infeliz, ya no me siento asi 
no me muero por ti"
Salsa,La India,Lagrimas,"Triste yo estarè al despertar 
cuando abrace a mi almhoada,poqrue tu no estas 
extrañandote,llorandote,son sentimientos 
que no puedo controlar,es espiritual,emocional 
quiero ahora desahogarme,necesito liberarme 

Estas lagrimas vienen y se van 
uno nunca sabe,a donde llegaran 
corren como un rìo,se unen con el mar 
son heridas que con el tiempo,se curaran 
son lagrimas,lagrimas 

Ahora desperte,siento algo que decir 
esè rìo se seco,y en el mar se disolviò 
no hay mas lagrimas,que derramar 
voy a vivir mi vida sin tu amor 
no vivire con màs dolor,ya no volvere 
a entragarme,necesito liberarme 

Estas lagrimas vienen y se van 
uno nunca sabe,a donde llegaran 
corren como un rìo,se unen con el mar 
son heridas que con el tiempo,se curaran 
son lagrimas,lagrimas 
son lagrimas,lagrimas,lagrimas 

ohoouuu 

No mas lagrimas 
No mas lagrimas 

(Coro) 
(Son lagrima) 
Corren como un rìo se unen con el mar 
(Son lagrimas) 
Son emociones que no puedes controlar 
(Son lagrimas ) 
Es espiritual,emocional 
(Son lagrimas) 
Ahora quiero deshaogarme,necesito liberarme 
de estas lagrimas 

No,no,no mas lagrimas 
Son lagrimas que vienen y se van 
uno nunca sabe,a donde llegaran 
corren como un rìo,se unen con el mar 
son heridas que con el tiempo,se curaran 
son lagrimas,lagrimas,lagriams 
son lagriamas,lagrimaaaas"
Salsa,La India,Lo Siento Mi Amor,"Lo siento mi amor 
pero hoy te lo voy a decir 
aunque pueda faltarme el valor 
al hablarte a la cara 

Lo siento mi amor 
pero ya me canse de fingir 
y pretendo acabar de una vez 
para siempre esta farsa 

Lo siento mi amor, lo siento mi amor 
lo siento mi amor......... 

Lo siento mi amor 
pero hoy te lo voy a decir 
aunque pueda faltarme el valor 
al hablarte a la cara 

Lo siento mi amor 
pero ya me canse de fingir 
y pretendo acabar de una vez 
para siempre esta farsa 
Lo siento mi amor, lo siento mi amor 
lo siento mi amor......... 

Hace tiempo que no siento 
nada al hacerlo contigo 
Que mi cuerpo no tiembla 
de ganas al verte encendido 
Y tu cara, y tu pecho, 
tus manos parecen escarcha 
y tus besos que ayer me exitaban no me dicen nada 

Y es que existe otro amor 
que lo tengo callado y callado 
escondido y vibra hasta mi alma 
queriendo gritarlo 

Ya no puedo ocultarlo 
no puedo callarlo no puedo 
y prefiero decirlo y gritarlo 
seguirte fingiendo 

Lo siento mi amor, lo siento 
lo siento mi amor, lo siento ......lo sientoooo 

CORO: TE ASEGURO QUE LO SIENTO MI AMOR, LO SIENTO 

Te aseguro que lo nuestro 
ya se acabo se termino 

CORO: TE ASEGURO QUE LO SIENTO MI AMOR, LO SIENTO 

Hace tiempo que no siento nada 
al hacerlo contigo 

CORO: TE ASEGURO QUE LO SIENTO MI AMOR, LO SIENTO 

Es que ahora existe otro amor 
que me hace sentir, me hace vivir 

CORO: ME CANSE DE FINGIR, 
YA NO PUEDO OCULTARLO NO PUEDO CALLARLO 

Pretendo acabar de una vez, esta falsa relacion 

CORO: ME CANSE, DE FINGIR 

INDIA: ......de fingir 
CORO: YA NO PUEDO OCULTARLO NO PUEDO CALLARLO. 

Donde vive el amor, 
muere el amor, 
no se siente pasion.... 

LA LA LA LA LA LA LA 

CORO: LO SIENTOOOO 

Ya no me siento culpable, 
la culpa la tienes tu y nada mas que tu 

CORO: LO SIENTOOOO 

lo siento mi amor, lo siento 
lo siento mi amor, lo siento 
lo sientoo"
Salsa,La India,No Debes Jugar,"Cariño, ya basta de tus juegos
Que yo no soy ningún juguete
Amigo,oohhh esto no es justo
Que yo no estoy para servirte
Se te hace fácil con mi amor siempre jugar
Pero muy pronto, yo te pongo en tú lugar
No debes jugar con mi amor
No debes jugar con mi cariño
Si me quieres, o no, ya dímelo
Para seguir ya mi camino

oooooo ... juiston texas xD
esta es para mi idola selena
con muxo sabor
de puerto rico a mexico al mudo entero

Cariño, ya sabes que te quiero
Y por mi parte, he dado todo
Amigo, no soy una muñeca
Que le das tu cuerda cuando quieres
Piensas que todo está en que digas si o no
Pero que dirás cuando te diga adios?
No debes jugar con mi amor
No debes jugar con mi cariño
Si me quieres, o no, ya dímelo
Para seguir ya mi camino

oooo no debes jugar... aii noo
no debes jugar cn mi amorr
no debes jugar cn mi kriño
si me keres o no ya dimelo!
para seguir ia mi kmino... 
ooooooo....
no debes jugarr...
no debes jugarr....
ya noo... ya no..

no debes jugar... cn mi amor
no debes jugar cn mi kriño
si me kieres o no ya dimelo 
para seguir ia mi kmino
no debes jugar!!!!!"
Salsa,La India,Soledad,"En los momentos mas sagrados de mi soledad
Es cuando pienso yo en ti
En esta hora tan intensa de mi intimidad
Anhelandote a ti

Me enamore cuando te conoci
Y no quiero a nadie como te quiero a ti
Amor prohibido es mi desilucion
Deseandote a ti

Cada vez que pienso en lo que pudo ser
Me siento infeliz
Yo te amare sin condicion
Y es para siempre

Y en los momentos mas sagrados de mi soledad
Vivo para ti

Amor Prohibido es mi desilucion
Deseandote a ti

Cada vez que pienso en lo que pudo ser
Me siento infeliz
Yo te amare sin condicion
Y es para siempre

Y en los momentos mas sagrados de mi soledad
Vivo para ti
En mis momentos tan sagrado, vivo para ti"
Salsa,La India,Tengo que dejarte ir,"Que triste, 
ya no estamos juntos. 
te has ido por el mundo 
usando una razón. 

Que triste, 
que me abandonaste y 
te aprovechaste 
de mi corazón... 

Pero ahora, 
ya no hay nada que decirme 
no tienes como herirme 
aquí esta mi decisión 

Tengo que dejarte ir, 
tengo que dejarte ir, 
entre la espada y las paredes 
haces conmigo lo que quieres 
pero eso ya se termino 

Oooh.. Oooh.. Uuuh.. Oooh.. 

Te fuiste me dejaste sola 
sola en mi mundo 
donde eras feliz 
te fuiste así lo decidiste 
para que perder el tiempo 
no mereces mi perdón.... 

Pero ahora, 
solo me falta olvidarte 
pero siento como odiarte 
es mejor decir adiós 

Tengo que dejarte ir, 
tengo que dejarte ir, 
entre la espada y las paredes 
haces conmigo lo que quieres 
pero eso ya se termino(x2) 

No podemos convivir.. 
Tengo que dejarte ir..... 

Cariño.. 

Tengo que dejarte ir,(x2) 

Ya no puedes rogarme, engañarme 
Aléjate de mi vida, 
no vuelvas mas 

Tengo que dejarte ir,(x2) 

Tengo que dejarte ir, 
aunque te quiera 

Hay no... 

Mi salvación 
es dejarte ir 

Así no podemos amarnos 

Así no podemos convivir 

Así no podemos amarnos 

Es que yo ya no quiero que estés junto a mi 

Así no podemos amarnos 

Entrando y saliendo de mi vida no puedes seguir 

Así no podemos amarnos 

Fingiendo 
Mintiéndome.. 

Hay no puedes mentirme, engañarme 

No podemos seguir así 

Ya no me engañas 

Aunque me duela tengo que dejarte ir"
