Genero,Artista,Titulo,Cancion
Salsa,Marc Anthony,Vivir Mi Vida,"Voy a reír, voy a bailar
Vivir mi vida, la-la-la-la
Voy a reír, voy a gozar
Vivir mi vida, la-la-la-la

Voy a reír (¡eso!), voy a bailar
Vivir mi vida, la-la-la-la
Voy a reír, voy a gozar
Vivir mi vida, la-la-la-la

A veces, llega la lluvia
Para limpiar las heridas
A veces, solo una gota
Puede vencer la sequía

Y para qué llorar, pa' qué
Si duele una pena, se olvida
Y para qué sufrir, pa' qué
Si así es la vida, hay que vivirla, la-la-le

Voy a reír, voy a bailar
Vivir mi vida, la-la-la-la
Voy a reír, voy a gozar
Vivir mi vida, la-la-la-la

¡Eso!

Voy a vivir el momento
Para entender el destino
Voy a escuchar el silencio
Para encontrar el camino

Y para qué llorar, pa' qué
Si duele una pena, se olvida
Y para qué sufrir, pa' qué
Si duele una pena, se olvida, la-la-le

Voy a reír, voy a bailar
Vivir mi vida, la-la-la-la
Voy a reír, voy a gozar
Vivir mi vida, la-la-la-la

¡Mi gente!

(Voy a reír, voy a bailar)
¿Pa' qué llorar? ¿Pa' qué sufrir?
Empieza a soñar, a reír

(Voy a reír, voy a bailar)
Siente y baila y goza
Que la vida es una sola

(Voy a reír, voy a bailar)
Vive, sigue
Siempre pa'lante, no mires pa' tras

¡Eso!
Mi gente
La vida es una

Voy a reír, voy a bailar
Vivir mi vida, la-la-la-la
Voy a reír, voy a gozar
Vivir mi vida, la-la-la-la"
Salsa,Marc Anthony,Flor Pálida,"Hallé una flor, un día en el camino
Que apareció marchita y deshojada
Ya casi pálida, ahogada en un suspiro
Me la llevé a mi jardín para cuidarla

Aquella flor de pétalos dormidos
A la que cuido hoy con todo el alma
Recuperó el color que había perdido
Porque encontró un cuidador que la regara

Le fui poniendo un poquito de amor
La fui abrigando en mi alma
Y en el invierno le daba calor
Para que no se dañara

De aquella flor, hoy, el dueño soy yo
Y he prometido cuidarla
Para que nadie le robe el color
Para que nunca se vaya

De aquella flor surgieron tantas cosas
Nació el amor que ya se había perdido
Y con la luz del sol se fue la sombra
Y con la sombra, la distancia y el olvido

Le fui poniendo un poquito de amor
La fui abrigando en mi alma
Y en el invierno le daba calor
Para que no se dañara

De aquella flor, hoy, el dueño soy yo
Y he prometido cuidarla
Para que siempre esté cerca de mí
Para que nunca se vaya

Para que nunca se vaya
Para que nunca se vaya
Para que nunca se vaya
Para que nunca se vaya

Le fui brindando cariño
Un poquito de amor (para que nunca se vaya)
Y en el invierno
Llenó mi jardín de color (para que nunca se vaya)
Ay, cuando la vi, me enamoré
Y me la llevé, me la llevé

¡Ave María!
Puerto Rico
¡Hasta acá, Sergio!
Esto sigue"
Salsa,Marc Anthony,Muy Dentro De Mi,"Solo quiero que vuelvas a mí
para otra vez poder sentir
lo que es amor, estaba muerto de dolor
sin ti mi vida ha sido gris
y no hay nada que me haga más feliz
que escuchar tu voz, oh, junto a mí
Hoy contigo sé lo que es vivir
sin tu amor yo no quiero seguir
ya no tengo miedo a amar
esta vez no tengo miedo a amar
Oh, que bello es amarte así
que suerte es tenerte a ti
escuchar tu voz, oh, junto a mi

Todo el tiempo que estuviste aqui y nunca te vi
y la luz de amor brillaba ardiendo en tu mirar
que ciego fui-nunca te vi
y hoy te siento
muy dentro de mi
Esa llama de amor sólo la enciendes tú
como extraño ver tu rostro bajo el cielo azul
Que ciego fui-nunca te ví
y hoy te siento
muy dentro de mí

Y pensar que hoy vives en mí
no sabía que podía existir
este amor entre los dos
hay tanto amor entre tú y yo

Tus palabras me llenan a mí
me motivan y me hacen sentir.. libre
Todo el tiempo que estuviste aqui y nunca te vi
y la luz de amor brillaba ardiendo en tu mirar
que ciego fui-nunca te vi
y hoy te siento
muy dentro de mi
Esa llama de amor sólo la enciendes tú
como extraño ver tu rostro bajo el cielo azul
Que ciego fui-nunca te ví
y hoy te siento
muy dentro de mí"
Salsa,Marc Anthony,Te Amaré,"Desde el día en que te conocí
Me enamoré de ti
En ti vi todo lo que siempre imaginé
Pronunciaste mi nombre y yo
Supe por fin que así
Comenzaría un cuento que no tiene fin

Oh, baby

Te amaré
Para la eternidad yo te amaré
Será pura lealtad
Yo te amaré
Y Nunca negaré que te amaré

Nada importa más que tu amor
Y solo Dios sabrá
Que tan enorme es la pasión que existe en mí
Moriría en tus brazos hoy
Sabiendo que tu mi amor
Abrazarías mi alma en tu interior

Oh, baby

Te amaré para la eternidad
Yo te amaré será pura lealtad
Yo te amaré y nunca negaré
Que te amaré

Niña tu amor afecta mi cuerpo
Cuando ríes parezco volar
Es la magia que sale de tu interior
Me rindo ante tu mirar y quisiera gritar que te amaré

Te amaré
Para la eternidad
Yo te amaré y mi esposa serás
Yo te amaré cásate con tu amado mi amor
Te amaré
Te amaré
Y mi esposa serás
(Te amaré)
Y te voy a llevar al altar"
Salsa,Marc Anthony,Tu Amor Me Hace Bien,"Te quiero así deliciosa insospechada
Porque creo en tu palabra
Porque yo siento que aún te necesito
Porque me alteras las ganas

Te quiero así estruendosa y delicada
Entre alegría y nostalgia
Porque me gusta tenerte vida mía
Y no quiero que te vayas
Porque el amor cuando es verdad sale del alma
Nos aturde los sentidos
Y de pronto descubrimos que la piel
Se enciende en llamas

Bien, tu amor me hace bien
Tu amor me desarma
Ay, tu amor me controla
Me endulza, me encanta
Pero bien, tu amor me hace bien
Tu amor me desarma
Ay tu amor me controla
Me vence, me amarra
Mira que me hace bien, que me hace bien

Te quiero así tan precisa equivocada
Con tus detalles que matan
Porque tenerte a mi lado me hace fuerte
Si eres mi reina y mi espada
Te quiero así cuando ríes cuando callas
Porque al caer me levantas
Porque mi voz y mi espíritu se agitan
Cuando dices que me amas
Porque tu amor como es verdad me vuelve el alma
Me despierta los sentidos
Y de pronto descubrí que aquí en mi piel
Se encienden llamas

Bien, ay tu amor me hace bien
Tu amor me desarma
Tu amor me controla
Me endulza, me encanta
Pero bien, tu amor me hace bien
Tu amor me desarma
Tu amor me controla
Me vence, me amarra"
Salsa,Marc Anthony,Vivir Lo Nuestro,"En un llano tan inmenso
Tan inmenso como el cielo
Voy a podar un jardin
Para que duerma tu cuerpo
En un mar espeso y ancho
Más ancho que el universo
Voy a construir un barco
Para que nade en el sueño

En un universo negro
Como el ebano más puro
Voy a construir de blanco
Nuestro amor para el futuro
En una noche cerrada
Voy a detener el tiempo
Para soñar a tu lado
Que nuestro amor es eterno

Y volar, volar tan lejos
Donde nadie nos obstruya
El pensamiento
Volar, volar sin miedo
Como palomas libres, tan libres como el viento

Y vivir, vivir lo nuestro
Y amarnos hasta quedar, sin aliento
Soñar, soñar despiertos
En un mundo sin razas
Sin colores, sin lamentos
Sin nadie que se oponga
En que tú y yo, nos amemos

Desde una montaña alta
Alta como las estrellas
Voy a gritar que te quiero
Para que el mundo lo sepa
Que somos uno del otro
Y jamás nos dejaremos
Y aunque nadie nos entienda
Por nuestro amor viviremos

En un universo negro
Como el ebano más puro
Voy a construir de blanco
Nuestro amor para el futuro
En una noche cerrada
Voy a detener el tiempo
Para soñar a tu lado
Que nuestro amor es eterno

Y volar, volar tan lejos
Donde nadie nos obstruya
El pensamiento
Volar, volar sin miedo
Como palomas libres, tan libres como el viento

Y vivir, vivir lo nuestro
Y amarnos hasta quedar, sin aliento
Soñar, soñar despiertos
En un mundo sin razas
Sin colores, sin lamentos
Sin nadie que se oponga
En que tú y yo, nos amemos

(Soñar despiertos
Vivir lo nuestro)

Voy a detener el tiempo
Y mantener a mi lado
Nuestro amor que es es sagrado

(Soñar despiertos
Vivir lo nuestro)

Solo viviré, solo viviré lo nuestro y amarnos
Hasta quedar sin aliento

(Soñar despiertos
Vivir lo nuestro)

Volar tan lejos
Como palomas libres
Como el viento

(Soñar despiertos
Vivir lo nuestro)

Voy a gritar que yo te quiero
Para que el mundo ya sepa
Que yo te amo
Sin ti me desespero

La la la, la la la

(Soñar despiertos
Vivir lo nuestro)

Ahhh! Vivir lo nuestro

(Soñar despiertos
Vivir lo nuestro)

Soñar, Volar, volar sin miedo
Vamos a vivir lo nuestro

Déjame, déjame amarte
Hasta quedar sin aliento

(Soñar despiertos
Vivir lo nuestro)

Vamos a vivir un sueño"
Salsa,Marc Anthony,Y Cómo Es El,"Mirándote a los ojos, juraría
Que tienes algo nuevo que contarme
Empieza ya mujer, no tengas miedo
Quizá para mañana sea tarde
Quizá para mañana sea tarde
¿Y como es él?
¿En que lugar se enamoró de tí?
¿De dónde es?
¿A que dedica el tiempo libre?
Pregúntale
¿Por qué ha robado un trozo de mi vida?
Es un ladrón que me ha robado todo
¿Y cómo es él?
¿En que lugar se enamoró de tí?
¿De dónde es?
¿A qué dedica el tiempo libre?
Pregúntale
¿Porqué ha robado un trozo de mi vida?
Es un ladrón que me ha robado todo
Arréglate mujer, se te hace tarde
Y llevate el paraguas por si llueve
Él te estará esperando para amarte
Y yo estaré celoso de perderte
Y abrígate, te sienta bien ese vestido gris
Sonríete, que no sospeche que has llorado
Y déjame, que vaya preparando mi equipaje
Perdóname, si te hago otra pregunta
¿Y cómo es él?
¿En que lugar se enamoró de ti?
¿De dónde es?
¿A qué dedica el tiempo libre?
Pregúntale
¿Porqué ha robado un trozo de mi vida?
Es un ladrón, que me ha robado todo
¿Y cómo es él?
¿En que lugar se enamoró de ti?
¿De dónde es?
¿A qué dedica el tiempo libre?
Pregúntale
¿Porqué ha robado un trozo de mi vida?
Es un ladrón, que me ha robado todo"
Salsa,Marc Anthony,Ahora Quién (Salsa Versión),"¿A quién van a engañar ahora tus brazos?
¿A quién van a mentirle ahora tus labios?
¿A quién vas a decirle ahora te amo?
Y luego en el silencio le darás tu cuerpo
Detendrás el tiempo sobre en la almohada
Pasarán mil horas en tu mirada solo
Existirá la vida amándote

¿Ahora quién?

¿Y quién te escribirá poemas y cartas?
¿Y quién te contará sus miedos y faltas?
¿A quién le dejarás dormirse en tu espalda?
Y luego en el silencio le dirás te quiero
Detendrá su aliento sobre tu cara
Perderá su rumbo en tu mirada y se le
Olvidará la vida amándote

¿Ahora quien? (ohhh)

¿Ahora quién? Si no soy yo me miro y lloro
En el espejo y me siento estupido, ilógico
Y luego te imagino toda regalando el olor
De tu piel, tus besos tu sonrisa eterna y hasta
El alma en un beso en un beso va el alma
Y en mi alma hasta el beso que pudo ser

¿Ahora quién? Si no soy yo me miro y lloro
En el espejo y me siento estupido, ilógico
Y luego te imagino toda regalando el olor
De tu piel, tus besos tu sonrisa eterna y hasta
El alma en un beso en un beso va el alma
Y en mi alma hasta el beso que pudo ser

Ohh, ¿ahora quién?

¿A quién le dejarás tu aroma en la cama?
¿A quién le quedará el recuerdo mañana?
¿A quién le pasarán las horas con calma?
Y luego en el silencio deseará tu cuerpo
Se dentendrá el tiempo sobre su cara
Pasará mil horas en la ventana se le acabará la voz
Llamandote

¿Ahora quién? ¿Ahora quién?

¿Ahora quién? Si no soy yo me miro y lloro
En el espejo y me siento estupido, ilógico
Y luego te imagino toda regalando el olor
De tu piel, tus besos tu sonrisa eterna y hasta
El alma en un beso en un beso va el alma
Y en mi alma hasta el beso que pudo ser

Ohh tus besos tu sonrisa eterna y hasta el
Alma en un beso en un beso va el alma y
En mi alma hasta el beso que pudo ser

Ohh ¿ahora quién?"
Salsa,Marc Anthony,Valió La Pena,"Mirándote a los ojos se responden mis porqués
Me inspiro en tus palabras y mi casa está en tu piel
Que tierno amor, mi devoción, viniste a ser mi religión
Mi dulce sentimiento de nada me arrepiento
Que vivan los momentos en tu boca y en tu cuerpo
Mujer

Valió la pena lo que era necesario para estar contigo amor
Tú eres una bendición
Las horas y la vida de tu lado nena
Están para vivirlas pero a tu manera
Enhorabuena, porque valió la pena
Valió la pena
Valió la pena lo que era necesario para estar contigo amor

Tú eres una bendición
Las horas y la vida de tu lado nena
Están para vivirlas pero a tu manera
Enhorabuena, porque valió la pena
Valió la pena, valió la pena
Valió la pena, nena

Te veo y me convenzo que tenías que llegar
Después de la tormenta aquí en tu pecho puedo anclar
Y ser más yo, de nuevo yo, y por bandera mi ilusión
Y mira si te quiero que por amor me entrego
Que vivan los momentos en tu boca y en tu cuerpo
Mujer

Valió la pena lo que era necesario para estar contigo amor
Tú eres una bendición las horas y la vida de tu lado nena
Están para vivirlas pero a tu manera
Enhorabuena, porque valió la pena
Valió la pena, valió la pena
Valió la pena, nena

Porque valió la pena amor
Sí que valió la pena
Vivir a tu manera amor, ay enhorabuena
Valió la pena"
Salsa,Marc Anthony,Y Hubo Alguien,"De repente te da
Por volverme a buscar
Por hablar de los dos
Y salir a cenar
Tal parece que yo
Te hice falta de más
Que no fuiste feliz
Con tu otra mitad

De repente te da
Por volver a sentir
Quién es el que en verdad
Sabe hacerte feliz
Pero se te olvidó
Que al marcharte de aquí
Yo quedé igual que tú
Libre para elegir

Y hubo alguien
Que se encargó de darme todo cada tarde
Que se moría por llenarme de detalles
Y palabras amables
Si hubo alguien
Que mientras tú vivías tu vida
Muy aparte
Se encargaba de la mía con coraje
Y logró conquistarme
Y a ese alguien
Una noche de locura interminable
Le entregué mi cariño
Mi cuerpo, mi alma, mi mente
Y mi ser
Como tú ya lo sabes

De repente te da
Por romper a llorar
Por decir que jamás
Me pudiste olvidar
Pero se te pasó
Que al marcharte de aquí
Yo quedé igual que tú
Libre para elegir

Y hubo alguien
Que se encargó de darme todo cada tarde
Que se moría por llenarme de detalles
Y palabras amables
Si hubo alguien
Que mientras tú vivías tu vida
Muy aparte
Se encargaba de la mía con coraje
Y logró conquistarme
Y a ese alguien
Una noche de locura interminable
Le entregué mi cariño
Mi cuerpo, mi alma, mi mente
Y mi ser
Como tú ya lo sabes

(Se te olvidó decirme adiós)
(Se te olvidó decirme adiós)
(Y hubo alguien)
Alguien que llenó mis días y mis noches
Con una nueva ilusión
(Se te olvidó decirme adiós)
Se te olvidó
(Se te olvidó decirme adiós)
(Y hubo alguien)
Se te olvidó decirme adiós
Y abría mis puertas para otro amor

(Ella, me da, tanto)
Tú me dejaste ir
(Me da mucho amor)
Y no pensaste en mí
(Y mucho calor)
Y ahora no puedes vivir
Sola, sin mí
Ahora hay alguien que me da
(Me da mucho amor)
Mucho amor y un cariño
Sincero, perfecto y bonito
Tú ves

Ataca cuco
(Que lloré, te digo que lloré que lloré)
(Que lloré, te digo que lloré que lloré)
(Qué lloré)
Deconsolado
Triste y desesperado
Tú no pensaste en mi pena
Y te marchaste, mi nena
Llora que te llora
Llora que te llora,
Pero tú ya no me importas
Ooh

Y ahora no puedes vivir
Sola, sin mí
Y ahora no puedes vivir
Sola, sin mí

Y ahora no puedes vivir
Sola, sin mí
Y ahora no puedes vivir
Sola, sin mí"
Salsa,Marc Anthony,Hasta Ayer,"Comprendan que no
Pretendo ofenderla
Tampoco le estoy haciendo
Un reproche
Usted es dueña de su vida
De su cuerpo y de sus noches

Confieso me enamoré como un niño
Y siento que no estoy arrepentido
Disfrute de tu experiencia
Hasta calmar mi ansiedad

Fui dueño de su alcoba
Y de su almohada
La tuve beso a beso, piel con piel
Y el Sol me sorprendió por su ventana
Cansado de delirio y de placer
Hasta ayer, hasta ayer

Y perdona usted señora
Pero cuando el alma llora
El silencio no es remedio
Para calmar el sufrir
Hasta ayer, hasta ayer

Mi dulce dama elegante
Supe que tiene otro amante
Al que quizás con el tiempo
Le hará lo mismo que a mí

Fui dueño de su alcoba
Y de su almohada
La tuve beso a beso, piel con piel
Y el Sol me sorprendió por su ventana
Cansado de delirio y de placer
Hasta ayer, hasta ayer

Y perdona usted señora
Pero cuando el alma llora
El silencio no es remedio
Para calmar el sufrir
Hasta ayer, hasta ayer

Mi dulce dama elegante
Supe que tiene otro amante
Al que quizás con el tiempo
Le hará lo mismo que a mí, eh

Fue enredándome en sus besos
Hasta que me volvió preso
Y en su juego despiadado
Me entregó con su pasión
Luego vino la traición
Y cuál si yo fuera un niño
Me dijo que su cariño
Lo brindaba a quien quisiera
Eres otra bandolera que jugo
Con mi querer
Ya no creo más mentiras
Ni en llanto de mujer

Yo te quería tanto, mujer, eh
Yo te adoraba tanto, mujer, eh"
Salsa,Marc Anthony,Dejé de Amar (part. Don Felipe Muñiz),"Si, es seguro que no pienso como antes lo hacia en ti
Pues mi vida está tan llena de detalles y mil cosas
Que me obligan a olvidarte sin saber
Que fuiste tú esa mujer que amé
Ay pero hoy, te has cruzado en un camino
Que mi mente encontró

Añorando sus recuerdos, que me incitaron a el amor
Y descubro entre las cosas que dejaste ya de ser
Esa mujer que amé
Y descubro con tristeza, que ha cambiado mi pensar
Y que soy un hombre solo, que ahora vive por vivir
Que no encuentra el placer, ni en la caricia, ni el beso
Porque dejo de amar

Dejé de ser, ese poeta enamorado
Que llenó la vida de poesías y mil versos
Ese romántico sincero, que un día por amor
Dijo mujer te quiero, dijo mujer te quiero
Sí, que el tiempo va pasando lentamente y sin piedad
Se lleva los recuerdos, ya no hay tanto para dar

Y descubro nuevamente que mi vida no es igual
Porque dejé de amar
Descubro con tristeza, que ha cambiado mi pensar
Y que soy un hombre solo, que ahora vive por vivir
Que no encuentra el placer, ni en la caricia, ni el beso
Porque dejó de amar

Dejé de ser, ese poeta enamorado
Que llenó la vida de poesías y mil besos
Ese romántico sincero, que un día por amor
Dijo mujer te quiero, dijo mujer te quiero
Dijo mujer te quiero
Dijo mujer te quiero"
Salsa,Marc Anthony,Te Conozco Bien,"Siento pena, pena porque te quise de veras
Rabia porque te di lo que nunca
Imaginaste un día tener
Todo el mundo a tus pies

Siento lástima porque yo sé que aún
Tú me extrañas
Lo noto en tu voz la' veces que llamas
Porque yo sé que sufres con él
Aunque finjas ser fiel

Mira si yo te conozco bien
Que me atrevería jurar
Que no duras junto a él
Un fin de semana más
Sin que extrañes en tu piel
Todas mis caricias

Yo que te conozco bien
Me atrevería a jurar que vas a regresar
Que tocarás mi puerta
Yo que te conozco a ti
Me atrevería a decir que estás arrepentida

Yo que te conozco bien
Me atrevería a jurar que vas a regresar
Que tocarás mi puerta
Yo que te conozco a ti
Me atrevería a decir que estás arrepentida

Mira si yo sé tanto de ti
Que me atrevería decir
Que en las noches al dormir
Me imaginas junto a ti
Devorando como el mar
Toda tu malicia

Yo que te conozco bien
Me atrevería a jurar que vas a regresar
Que tocarás mi puerta
Yo que te conozco a ti
Me atrevería a decir que estás arrepentida
Yo que te conozco bien
Me atrevería a jurar que vas a regresar
Que tocarás mi puerta
Yo que te conozco a ti
Me atrevería a decir que estás arrepentida

(Te conozco bien, estás arrepentida)
Yo que conozco tu cuerpo y tu piel
Me atrevería a jurar que me extrañas mujer

(Te conozco bien) te conozco bien (estás arrepentida)
Que tú volverás que tú volverás
Que tú volverás a mi puerta y para ese momento siempre estará abierta

(Te conozco bien) te conozco bien (estás arrepentida)
Tú regresarás y aquí te espero negrita

Pa-pa-ra ri-ra-ra (¡hey!)
Pa-pa-ra ri-ra-ra (¡huy!)
Pa-pa-ra ri-ra-ra pa-pa-ra ri-ra-ra
Pa-pa-ra ri-ra-ra pa-pa-ra ri-ra-ra
Pa-pa-ra ri-ra-ra pa-pa-ra ri-ra-ra
Pa-pa-ra ri-ra-ra pa-pa-ra ri-ra-ra

Volverás (pa-pa-ra ri-ra-ra pa-pa-ra ri-ra-ra) otra vez
Yo lo sé (pa-pa-ra ri-ra-ra pa-pa-ra ri-ra-ra) dime que
Volverás (pa-pa-ra ri-ra-ra pa-pa-ra ri-ra-ra) otra vez
Yo lo sé (pa-pa-ra ri-ra-ra pa-pa-ra ri-ra-ra) dime qué
Volverás... (pa-pa-ra ri-ra-ra pa-pa-ra ri-ra-ra)"
Salsa,Marc Anthony,Que Precio Tiene El Cielo,"Como es que te amo así
Con todo el pensamiento
Como lograste entrar
Así sin preguntar robándote el momento

Como es que te amo así
Sin tanto sufrimiento
Como es que es natural
Que cada amanecer quiero parar el tiempo

Es que te he dado todo y nada es suficiente
No por que me lo pide sino porque faltan frenos al quererte

Ohhh

¿Qué precio tiene el cielo?
Que alguien me lo diga
Que más que darte amor
Yo quiero regalarte el azul de los días
¿Qué precio tiene el cielo?
Que alguien me lo diga
Si yo con esta historia siento que la gloria ha llegado a mi vida
¿Qué precio tiene el cielo?
Que alguien me lo diga
Yo pago por mi alma sin temor a nada
Yo te doy mi vida

Ohhh

Esta noche te doy
De todo cuanto tengo
Y no me doy abasto
Tiendo a imaginar que el mundo yo te invento
Y desde aquí se ven, las nubes y los vientos
Por eso aquí te traje porque por lo pronto es todo lo que tengo
Es que te he dado todo y nada es suficiente
No por que me lo pides sino porque faltan frenos al quererte

Ohhh

¿Qué precio tiene el cielo?
Que alguien me lo diga

Que más que darte amor
Yo quiero regalarte el azul de los días
¿Qué precio tiene el cielo?
Que alguien me lo diga
Si yo con esta historia
Siento que la gloria ha llegado a mi vida
¿Qué precio tiene el cielo?
Que alguien me lo diga
Yo pago con mi alma sin temor a nada
Yo te doy mi vida

Eternamente yo te inventaría
Como esta tantas otras melodías
Para no faltarte si te falto un día

¿Qué precio, tiene?
Dime que precio tiene
Tiene
Quiero regalarte el azul de los días la luna los mares mi vida
Qué precio, tiene?
Dime que precio tiene
Tiene
Y es que te he dado de todo y nada es suficiente
(Te lo digo de frente)
¿Qué precio, tiene?
Dime que precio tiene
Tiene
Oye mamá te lo voy a dar
Con mi alma lo voy a pagar

Chichi, ohhh jooma

Ohhh jooma
Chichi

Ataca Sergio
Que me lo digan, que me lo digan
Alguien que me lo diga
Que me lo digan
Que me lo digan, que me lo digan
Alguien que me lo diga
Que me lo digan
Que me lo digan, que me lo digan
Alguien que me lo diga
Que me lo digan"
Salsa,Marc Anthony,I Need You,"From the day that I met you, girl
I knew that your love would be
Everything that I ever wanted in my life
From the moment you spoke my name
I knew everything had changed
Because of you I felt my life would be complete

Oh baby I need you
For the rest of my life
Girl I need you (I really need, nobody but you)
To make everything right
Girl, I love you
And I'll never deny that
I need you (I really need, nobody but you)

Nothing matters but you my love
And only God above
Could be the one to know exactly how I feel
I could die in your arms right now
Knowing that you, somehow,
Would take my soul and keep it deep inside your heart

Oh baby I need you
For the rest of my life
Girl I need you (I really need, nobody but you)
To make everything right
Girl, I love you
And I'll never deny that
I need you (I really need, nobody but you)

Girl, your love to me feels just like magic
When you smile, you have total control
You have power like nothing I've felt before
I've let all of my feelings show
Cause I want you to know that
I need you (I really need, nobody but you)

I need you
For the rest of my life
Girl I need you (I really need, nobody but you)
Say that you'll be my wife
Oh I... love you
Won't you marry me, marry me
I need you (I really need, nobody but you)

Oh I need you
For the rest of my life
Oh I... need you (I really need, nobody but you)
Won't you marry me, marry me
I love you
I really need, baby
I need you (I really need, nobody but you)

Girl you really need
I need you
Girl you really need
I need you
Need you (I really need, nobody but you)
Ohh baby
I love you
I need you (I really need, nobody but you)

Girl I really need you
Need your love
Oh baby
Won't you marry me (I really need, nobody but you)
Won't you marry me, marry me
I love you
Ohhh
I need you! (I really need, nobody but you)"
