Genero,Artista,Titulo,Cancion
Reggaeton,Bad Bunny,La Corriente (part. Tony Dize),"La melodía con la calle
Tony Dize

Baby, dame la señal
Si me sigues mirando así
Te voy a besar, te voy a besar (te voy a besar)
Si es contigo, no lo tengo que pensar (no, no)

Porque tú no eres como otras, no, tú eres diferente
Viviendo la vida loca, siempre en contra 'e la corriente
Hace' lo que a ti te dé la gana, gana
Siempre pichea', meno' si el perreo llama, llama (ey, ey)

Quiero que tú me enseñe', que sea' mi teacher
Una bitch, una pitcher, ey
Lowkey, anda a switche
Loca que me la chi—

Ey, ey, la baby ya va pa' treinta y se ve violenta, se ve violenta
Hace rato está mirando, me di cuenta, ya me di cuenta
Ella sabe má' que tú, así que no sea' tonto, chico, no le mienta'
No te viva' la película, que ella es la película y de la' que no se renta

Sube ese culo y to' comentan
Una bad bitch, gyal de lo' 90
Esa carita agridulce es lo que me tienta
Una picky, una menta

Pa' mamártela y rompértela
Bajo pa' tu cancha y wachartela
Si tu amiga quiere, ve, invítala
Ve, invítala, que se va a hacer

Pero yo no quiero a otra, no, tú eres diferente
Si tú fuera' una ola, puede que me lleve la corriente
Tú hace' lo que a ti te dé la gana, gana
Siempre pichea, meno' si el perreo llama, llama (ey)

Tú eres de las que sale
Tarde en la noche
Pero sin dejarse ver (no, no)
Se dejó y no va a volver (nah, nah)

Ahora está mejor soltera
Sale sin hora de llegada
Nadie dice nada, hace lo que quiera
La calle prendía' en candela (ey, ey)

Y antes de enfangarse, prefiere a solas acostarse
Parece colombiana, le dicen la parce
No necesita un hombre, pa' ti hay que buscarse
Ella se la vive bailando, tiene a to'a la disco mirando

Porque tú no eres como otras, no, tú eres diferente
Viviendo la vida loca, siempre en contra 'e la corriente
Tú hace' lo que a ti te dé la gana, gana
Siempre pichea', meno' si el perreo llama, llama

Yeah-yeah, ey
Bad Bunny, baby
Be-be-be-be
Ey, ey, Tony Dize, Tony Dize
La melodía con la calle
La melodía con la calle
Bad Bunny, baby, bebé-brrum
Eh, eh"
Reggaeton,Bad Bunny,La Santa (part. Daddy Yankee),"Tú no ere' una santa, ni yo soy un santo
Nos conocimo' pecando, ahora me está' buscando
Porque quiere más de mí (Bad), y yo te lo doy (Bunny)
Te viene' y me voy (DY)
Te lo dije que esto era pa' jugar
Que no te podía' enamorar (¡sube, sube!)

Que ahora me quiere' cambiar
Sabiendo cómo soy, tú sabe' lo que doy
No te haga', que tú ere' igual (¿qué, qué, qué?)
No te haga' la santa, el perreo te encanta (you know)

Y ahora me quiere' cambiar (yeh, eh)
Sabiendo cómo soy, tú sabe' lo que doy
No te haga', que tú ere' igual (tú ere' igual, bebé)
No te haga' la santa, el perreo te encanta (Daddy)

Mami, somo' polo positivo y negativo (¿qué?)
A la flecha de Cupido siempre me le esquivo
Tenemo' secreto' guarda'o en el archivo
No va a haber confianza si contigo convivo

Baby, 'tás calentándote, yo calentándome
Y tú dice' que tú ere' brava, pero a vece' te me quita
Y vuelve' y me excita'
Pero yo no soy el hombre que necesita'

Yo no voy con labia, no
Tú sabía' la que había, baby
El romance no es mi área, no
No me diga' que te enamoraste de mí

Yo no voy con labia, no
Tú sabía' (tú sabía') la que había, baby
El romance no es mi área, no
No me diga' (no me diga') que te enamoraste de mí (mí)

Y ahora me quiere' cambiar (sube)
Sabiendo cómo soy, tú sabe' lo que doy
No te haga', que tú ere' igual (tú ere' igual, bebé)
No te haga' la santa, el perreo te encanta

Y ahora me quiere' cambiar (me quiere' cambiar)
Sabiendo cómo soy, tú sabe' lo que doy
No te haga', que tú ere' igual
No te haga' la santa, el perreo te encanta (Bad Bunny, c'mon)

No me diga' que me quiere'
No me diga' que me ama'
Tú sabe' que no te creo
Mucho meno' en tu cama

Seguimo' envuelto' en la bellaquera
Ey, ey, la noche entera
Eso de enamorarse no es pa' cualquiera
Tengo el corazón dentro de la nevera

Lo tengo frío, frío, sorry, pero en nadie confío
Tú sigue en lo tuyo y yo en lo mío
Buena' noche', fue un placer, ey
Pero no me va' a convencer (c'mon)

Yo no voy con labia, no
Tú sabía' la que había, baby
El romance no es mi área, no
No me diga' que te enamoraste de mí

Yo no voy con labia, no
Tú sabía' (tú sabía') la que había, baby
El romance no es mi área, no
No me diga' (no me diga') que te enamoraste de mí (mí)

Y ahora me quieres cambiar
Sabiendo cómo soy, tú sabe' lo que doy
No te haga', que tú ere' igual (tú ere' igual)
No te haga' la santa, el perreo te encanta

Y ahora me quiere' cambiar
Sabiendo cómo soy, tú sabe' lo que doy (yo')
No te haga', que tú ere' igual
No te haga' la santa, el perreo te encanta, eh

Mucho party, mucho money
Daddy Yankee, Bad Bunny
Mucho party, mucho money
Daddy Yankee, Bad Bunny"
Reggaeton,Bad Bunny,Un Coco,"Antes que este phillie se apague, yo te voy a olvidar
Yo te voy a olvidar
Antes que este phillie se apague, yo te voy a olvidar
Yo te voy a olvidar, yal

Me paso fumando bajo las palmera'
A ver si me cae un coco en la cabeza y me borra mi vida entera
Veo parejitas dándose beso' y me da dentera
Voy a tirarle el radio por mar si sale Sin Bandera porque

No puedo escuchar cancione' de romance
Me cansé que de pensar en ti no me canse
El último pétalo me dijo que aún hay chance
No sé si es verdad, pero si va' a volver, avance

Por favor
Aunque sea un mes ante' que salga el Sol
Que en la mañana coja alergia buscando tu olor
Tanto' trofeo' y aún me siento perdedor, perdedor

Búscame el encendedor, ey
Que si no te olvido, me voy a mudar pa' Chile
Pa' Argentina o pa' El Salvador
Pero denme el lighter, dije, por favor, por favor

Y ante' que este phillie se apague, yo te voy a olvidar
Ey, yo te voy a olvidar
Ante' que este phillie se apague, yo te voy a olvidar
Yo te voy a olvidar, yal

Ey, ey, ey
Me estoy ahogando y a la' ola' le' pedí socorro
Escribo tu nombre en la arena, a ver si así lo borro
Pero tus labio' y tus ojo', los tengo de gorro

No sales de mi cabeza
Otro phillie y otra cerveza
Ya tu recuerdo me pesa
Te difrazaste de Rubí, y eras Teresa
Pero soy un pendejo y todavía me interesa'

Ey, ey, saber de tu paradero
Y preguntarte si fue verdadero
O si está' volá' como avión y yo fui pasajero
Qué cojones, todavía yo te quiero

Eh, eh, eh
Los muchacho' dicen que yo estoy charriando
Eh, eh, ey
Pero, en bajita, seguimos quemando

Y ante' que este phillie se apague, yo te voy a olvidar
Yo te voy a olvidar
Ante' que este phillie se apague, yo te voy a olvidar
Yo te voy a olvidar, gyal

Y ante' que este phillie se apague, yo te voy a olvidar
Ey, yo te voy a olvidar
Y ante' que este phillie se apague, yo te voy a olvidar
Ey, yo te voy a olvidar, gyal"
Reggaeton,Bad Bunny,Tu No Metes Cabra,"Cuando ustede' me ven, yo sé que tiemblan
Yo estoy ready twenty four hours
El Father, pídanme la bendición
(Yeh, yeh, yeh, yeh)

Tú no metes cabra, saramambiche (yeh)
Tú no metes cabra, saramambiche (¡uh!)
Tú no metes cabra, saramambiche (¡no!)
Tú no metes cabra, saramambiche

Tú no metes cabra, saramambiche
Tú no metes cabra, saramambiche
Tú no metes cabra, saramambiche
Y si te me embocas, nos vamos al switche

Yeh, estoy subiendo como espuma
Prendiéndole en la cara al que no fuma
Ando con Adidas, veloces como un puma
El Undertaker saliendo de la bruma

Y se apagan las luce', prende el wax para que me muse
Tú no metes cabra, tú no luces
No es el Mercedes, es quien lo conduce
Y dime qué son Retro sin un Jordan que las use, yeh

Evita el delay
Aquí, si no te ponchamos, te damos doble play (¡uh!)
No existe replay
Son Miami sin Lebron y Wade (prr)

Nos vamos a switcher, aunque me fichen (yeh)
Me tiran, pero soy un pitcher
Tu jeva loca que me la chiche (¡uh!)
Yo matando y tú mirando en los bleacher, yeh

Tú no metes cabra, saramambiche
Tú no metes cabra, saramambiche
Tú no metes cabra, saramambiche
Tú no metes cabra, saramambiche

Tú no metes cabra, saramambiche (no)
Tú no metes cabra, saramambiche
Tú no metes cabra, saramambiche (yeh)
Y si te me embocas, nos vamos al switche

Yo controlo la calle sin ser bichote
Un melón y pico dentro del pote
Yo tengo el pique flow chipotle (¡uh!)
Shaquille O'Neal debajo del aro, nadie me quita un rebote

La nueva religión, yo soy la nueva era (do it)
El responsable de que ustede' se cayeran (yeh)
Apartamento frente al mar, lo tengo de pecera (¡uh!)
Y el Sour Diesel directo de la nevera

Se bebe y se chinga como en prom (prom)
Yo soy un hijoeputa-punto-com
En el VIP, soy Donald Trump (yeh)
Yo tengo to' Gucci, hasta las foam, yeh

Tú no metes cabra, saramambiche
Tú no metes cabra, saramambiche
Tú no metes cabra, saramambiche
Tú no metes cabra, saramambiche (¡uh!)

Tú no metes cabra, saramambiche (¡no!)
Tú no metes cabra, saramambiche
Tú no metes cabra, saramambiche
Y si te me embocas, nos vamos al switche

(Yo no escucho) yeh, yeh, yeh, yeh
(Lo que ustedes están diciendo ahí abajo)
Bad Bunny, baby, bebé, bebé
Trap Kingz, baby (el jefe)
Hear This Music (el jefe)
Díselo, Luian (Mambo Kingz)
¡Mambo Kingz!"
Reggaeton,Bad Bunny,"Me Mata (part. Arcangel, Bryant Myers, Almighty, Noriel, Baby Rasta y Brytiago)","[Bad Bunny]
Tú estás buena, bebé, y sin mandarte a hacer
Quiero fumar y darte hasta el amanecer
Te juro que me gusta todo de ti
Todo de ti

Pero lo que me mata
Es cuando pone cara de bellaca
Se besa con la amiga y no son pata’
Fina pero en la cama tremenda sata

[Baby Rasta]
Y lo que a mí me mata
Es cuando pone cara de bellaca
Tú misma baja' el zíper y lo saca'
Fina pero en la cama tremenda sata, yeh

[Arcángel]
(Austin, baby)

Me bebí un jarabe, que es pa’ la tos
Le pedí una amiguita y me trajo dos
Le metí toda la noche a lo nivel Dios
Me llegó el regalo adelantado de Santa Claus (wow)

Fuerte y no fue golpe de suerte (no)
Le di una pastilla y se puso indecente (loquita)
Aunque media loquita, la dé mente
La enseñé este bicho y se puso coherente

Por eso ella siempre me llama
Cada vez que ella está sola
Cuando llego, me lo mama
Bien rico, no importa la hora

Siempre se me manifiesta
Luego tomamo’ una siesta
Despertamo’ y se me trepa encima
Y pa’ hacerlo de nuevo se presta (Noriel)

[Noriel]
Mi baby es una atrevida
Quiere chingar conmigo de por vida
El novio un par de veces se las pegó
Porque ese cabrón la tenía aburrida

Siempre que la llamo, le llega enseguida
To' lo que me gusta nunca se le olvida
Quieres que te diga: Ella va a ser leal a este bicho
Mientras el cabrón tenga vida

Se toca y me baila
Si anda con la amiga, digo que la traiga
Pon el teléfono en modo de avión
Pa’ que nunca le suene y no se me distraiga

Siempre echamos más de uno
Se envuelve en el humo, fuma si yo fumo
La baby dice que no es pata
Pero le encanta los dos pa' uno

Todo los trucos, ella se lo sabe
Chingando tiene la clave
Que los dos pensamos iguales
Y en la cama todo se vale

Es una diabla
Que na’ más piensa en mí cuando está bellaca

[Bad Bunny]
Pero lo que me mata
Es cuando pone cara de bellaca
Se besa con la amiga y no son pata’
Fina pero en la cama tremenda sata

[Baby Rasta]
Y lo que a mí me mata
Es cuando pone cara de bellaca
Tú misma baja' el zíper y lo saca'
Fina pero en la cama tremenda sata, yeh

[Bryant Myers]
(Bryant Myers)

Hoy te vo’a torturar, baby, tu cuerpo es un mural
Ese culote es natural, yo te lo quiero inaugurar
Como un The Purge, esta noche yo te voy a depurar
Cuanto tú me va' a durar, ese totito hoy yo te lo voy a saturar

Tú eres una enferma
Y este bicho es el único que te va a curar

Yo sé que a ti y a la amiga tuya
También le encantan el bi’
Ustedes hacen threesome’ con cojone’
Ya casi parecen lesbi’, baby

En mi chalet hay, room service
Hoy te lo voy a meter completo
Hasta que te llegue a la pelvis
A tu ex cuando yo lo vi
Lo puse a correr toda la recta del presbi (Brytiago, baby)

[Brytiago]
Toda’ a las doce
Un feeling, ojito’ chiquito’, nadie las conoce’
Una es como Rihanna, la otra es Amber Rose
Adicta con ser atrevida
Loca con que una a la otra la roce
Se pasa metida en YouPorn
Buscando aprenderse todita' las poses

Me lo chupa y no para hasta que acaba
Me la grajeo con la lengua llena de baba
Sin phillies, dijo que no se arrebataba
Cuando tiene relaciones, ella misma es la que se graba

Vive viajando en éxtasis
Tú la ves por las redes y no se ve así
Yo soy un bellaco desde que nací
Le invite pa’ hacer un trio y las dos dijeron que sí

El sexo va a llover, exceso de placer
No sé si va a poder
Con toda las poses que le voy a hacer
Hoy no vamos a joder, apenas empecé
Yo abuso contigo, como mismo uso
De la tramadol y la percocet

[Baby Rasta]
Y lo que a mí me mata
Es cuando pone cara de bellaca
Tú misma baja' el zíper y lo saca'
Fina pero en la cama tremenda sata, yeh

[Almighty]
(Almighty, is The Game Changer)

Si tu amiga hoy no puede
Busca otra que diga que sí
Y se besan entre sí
Luego hacen la 6-9

Las dos se tocan y llueven
La pongo a fumar pa’ que se eleven
Baby, cumple mi fantasy
O es que tú no te atreve'

Llegó tu Roberto Clemente
También tu Chayanne, yo soy tu pirata
Quiero fumar con tu gata
Baby, yo cacho las libras de Gucci y Barata

Bajo con la aguja y la bata
Y te inyecto la tecata
Me lo mama, mientras se retrata
Si tú eres pata, yo meto las patas

Es tan poderosa, el buffet ponderosa
Son espinas sin rosa, ustedes son un libro
Y yo soy el lector que siempre las desglosa
Que Dios me perdone, ateo a los condone’
Me le vengo adentro y hasta el Sol de hoy no hay pensiones
Solo mis hijos y son estos cabrones, Almighty

[Bad Bunny]
Baby, yo soy tu Drake
Tú eres mi Rihanna (Rihanna)
Yo soy un bellaco bebe
Pero tú me gana’

Yo soy fan de tu boca
Tus nalgas, tus tetas, tus ojos y tu piel
Pero esa carita de bellaca
Es la que hace que yo te lo quiera meter

Ninguna puta le llega
Sale a janguear y a la casa no llega
Tiene novio, pero se las pega
Mi bicho es su hook y no se le despega

Baby, tú eres bellaca
Tú envías el location pa’ que lo confirme
Yo dándote bicho y tu novio metido en Planet Fitness

[Arcangel y Almighty]
Austin, baby
Arcángel, pa’
Bad Bunny
Bryant Myers (Almighty)
Noriel, Brytiago
Baby Rasta
Hear This Music

Dí-Díselo Luian
Mambo Kingz (espérate, dame un break)
Mambo Kingz, oh, yeah
Uy, Alex Killer

Mami, yo sé que tú estabas esperando
Que yo mencionara el bicho
O ¿qué tú quieres? ¿Que te hable de rifle y de pistola?
Si a última hora lo que yo te voy a meter es el bicho

(La industria de los inmortales)"
Reggaeton,Bad Bunny,Tarot (part. Jhay Cortez),"Verte en el VIP desde lejito' es un privilegio
Baby, tú eres un mito, ese culito es un misterio
Tú loquita por que te cojan
Y yo que me coja en serio

Yo, a Dios, le voy a pedir que te lo explique
Que tú estas muy dura, tú tiene' el pique
No te sorprenden to's estos bobo' con ticket
Tú lo que quieres es quе te chi-

Ojalá y tenga suеrte
Porque no cualquiera puede llegarte
Pero yo voy a mí pa' que hoy tú me la suelte'
Tienes la disco de museo, ma', tú eres arte
Y yo pagué pa' verte

Y va a gustarte
Todo lo que quiero hacerte
Hoy tengo que hablarte
Tienes la disco de museo, ma', tú eres arte
Ojalá y tenga suerte

Eh, ey
Si subiste una story, es pa' que te lo comenten
Si te mando un fueguito, es que me tienes caliente
Tú estás dura de espalda y más rica de frente, eh

Mami, yo le llego al oeste si es pa' darte este, ey
Baby, yo quiero darte la' buenas noches para que te acuestes
Y si se da al fin, nos vamo' de aquí
Ojalá digas que sí, vamo' a darle

Que andas bonita y suelta, bonita y suelta
Se alejó del gato y tiene cinco de repuesta
Yo quiero saber con qué pantycito te acuesta'
Baby, dime si tú 'tás puesta

Ojalá y tenga suеrte
Porque no cualquiera puede llegarte
Pero yo voy a mí pa' que hoy tú me la suelte'
Tienes la disco de museo, ma', tú eres arte
Yo pagué pa' verte

Y va a gustarte
Todo lo que quiero hacerte
Hoy tengo que hablarte
Tienes la disco de museo, ma', tú eres arte
Ojalá y tenga suerte

Pa' ganarte
Y por más que me ignoras, 'tá imposible ignorarte
El Sol al lado tuyo no es tan brillante
Yo soy DaVinci y tú mi obra de arte, tú eres arte

Porque tu flow, Dios lo bendiga
Llega y hasta las babies te ligan
Abdominal y sin hacerte la barriga
Tu ex todavía te hostiga

Porque tu 'tá costiza'
To' la' marca' actualiza'
Baby, si fuera cristiano
Hoy te fuera a bautizar

Quitate to', que ya te la quiero ver
Que tú estás trending sin tenerte que joder
Vente conmigo, nos podemos perder
A ti te va a correr

Ojalá y tenga suеrte
Porque no cualquiera puede llegarte
Pero yo voy a mí pa' que hoy tú me la suelte'
Tienes la disco de museo, ma', tú eres arte
Yo pagué pa' verte

Y va a gustarte
Todo lo que quiero hacerte"
Reggaeton,Bad Bunny,Agosto,"Baby, vamo' a hacerlo bajo las estrella'
Y que la Luna nos grabe
Mañana, dónde estará, no se sabe
Ojalá y el verano nunca se acabe, nunca se acabe

Baby, vamo' a hacerlo bajo las estrella'
Y que la Luna nos grabe
Mañana, dónde estará, no se sabe
Ojalá y el verano nunca se acabe, nunca se acabe, eh-eh, eh-eh

Sexo, playa
Lo que yo quiero contigo, donde diga', yo te sigo
A Dios le pedí un deseo, pero no me lo ha cumplido
Tu Instagram, yo lo stalkeo, yo siempre lo investigo

Pa' ver si sigue' soltera o si volviste
Pa' ver si estás en PR o si te fuiste
Yo hago lo que sea pa' que no estés triste
Mi mente es una bellaca, siempre te desviste

Y dime qué va a pasar
Dime ya, tú ere' una player, ¿te gusta jugar?
Pide lo que sea y se te va a dar
Sí, sí, se te va a dar

Yo siempre tengo un diamond pa' mi gyal
Un perreo en el billar
La noche no' quiere invitar a los do'

Baby, vamo' a hacerlo bajo las estrella'
Y que la Luna nos grabe
Mañana, dónde estará, no se sabe
Ojalá y el verano nunca se acabe, no se acabe, eh-eh, eh-eh"
Reggaeton,Bad Bunny,Efecto,"Yeah-yeah-yeah-yeah-yeah-yeah
Eh-eh-eh-eh

No sé si es casualidad que yo me sienta así
Siempre que tú estás cerquita de mí
Dime qué me hiciste, qué droga me diste
Que, desde aquella noche, no soy igual
Tú me mira' y empiezo a sudar
Siento que puedo volar

Baby, la nota ya está haciendo efecto
Mi mundo está jodío' y me siento perfecto
Porque estás tú, aquí, moviéndote así, no pare'
Baby, tú eres mi droga, esta noche no le baje'

Porque la nota ya está haciendo efecto
Mi mundo está jodío' y me siento perfecto
Porque estás tú, aquí, moviéndote así, no pare'
Baby, tú eres mi droga, esta noche no le baje'

(Esta no, esta sí)
(Esta no, esta sí)
(Esta no, esta sí)
(Esta no)

El gatito tuyo te perdió por negligencia
Y yo que no creo en la abstinencia
Esta noche, en la cama, va a haber turbulencia'
Qué rico tú mama', te vo'a dar la permanencia

Ese totito e' la eminencia
Pa' darle tengo licencia
Desde que fuimo' a Florencia
Se puso más bicha, pero no pierde la esencia

No, no, de Carola
No, no, no, no anda sola
No, no, no le diga' hola
O va' a ser otro pa' la cola

Tu crico te me amola
Yo soy fan de esa popola
Más las picky, las endo, la coca y la rola
Eres tú quien me controla, eh

En tus ojo', veo el mar
Mami, llévame en tu ola
Hoy me siento bien puta, re piola, ey

Porque la nota ya está haciendo efecto
Mi mundo está jodío' y me siento perfecto
Porque estás tú, aquí, moviéndote así, no pare'
Baby, tú ere' mi droga, esta noche no le baje"
Reggaeton,Bad Bunny,DÁKITI (part. Jhay Cortez),"Baby, ya yo me enteré, se nota cuando me ve'
Ahí donde no ha' llega'o, sabe' que yo te llevaré
Y dime qué quiere' beber, e' que tú ere' mi bebé
Y de nosotro' quién va a hablar, si no nos dejamo' ver

Y a vece' e' Dolce, a vece' e' Bulgari
Cuando te lo quito después' de lo' partie'
La copa de vino, la libra de mari
Tú está' bien suelta y yo de safari

Tú mueve' el culo fenomenal
Pa' yo devorarte como animal
Si no te ha' veni'o, yo te vo' a esperar
En mi cama, y lo voy a celebrar

Baby, a ti no me opongo
Y siempre te lo pongo
Y si tú me tira'
Vamo' a nadar en lo hondo

Si e' por mí, te lo pongo
De septiembre hasta agosto
A mí sin cojones
Lo' que digan tu' amiga'

Ya yo me enteré, se nota cuando me ve'
Ahí donde no ha' llega'o, sabe' que yo te llevaré
Y dime qué quiere' beber, e' que tú ere' mi bebé
Y de nosotro' quién va a hablar, si no nos dejamo' ver

(¿Me sigue'?)

Mami, me tiene' juquea'o, sé
Si fuera' la uru', me tuviese' parquia'o
Dando vuelta por el Condado
Contigo siempre arrebata'o

Tú no ere' mi señora
Pero toma cinco mil y gástalo en Sephora
Louis Vuitton, ya no compra en Pandora
Como piercing, a los hombre' perfora, eh eh eh 

Hace tiempo le rompieron el cora (el cora)
Estudiosa, puesta pa' ser doctora (doctora)
Pero le gustan lo' títere' wheeleando motora (motora)
Yo estoy pa' ti la' veinticuatro hora'

Baby, a ti no me opongo
Y siempre te lo pongo (yo te lo pongo)
Y si tú me tira'
Vamo' a nadar en lo hondo (nadar en lo hondo)

Si e' por mí, te lo pongo
De septiembre hasta agosto
Y a mí sin cojone'
Lo' que digan tu' amiga'

Ya yo me enteré, se nota cuando me ve'
Ahí donde no ha' llega'o, sabe' que yo te llevaré
Y dime qué quiere' beber, e' que tú ere' mi bebé
Y de nosotro' quién va a hablar, si no nos dejamo' ver

Y a vece' e' Dolce, a vece' e' Bulgari
Cuando te lo quito después' de lo' partie'
La copa de vino, la libra de mari
Tú está' bien suelta y yo de safari

Tú mueve' el culo fenomenal
Pa' yo devorarte como animal
Si no te ha' veni'o, yo te vo' a esperar
En mi cama, y lo voy a celebrar"
Reggaeton,Bad Bunny,Una Vez (part. Mora),"Lo nuestro no te conviene, eh
Pero él ya no te entretiene, eh
Sé que te incito a pecar, lo tratas de controlar
Pero no se detiene, eh

Y déjame sentirte una vez
Por si no te vuelvo a ver
Luego lo sigo normal con mi vida
Y tú la tuya con él

Pero déjame sentirte una vez (sentirte una vez)
Por si no te vuelvo a ver
Luego lo sigo normal con mi vida

Pero dale, escápate
Y si hay gente, tápate
Y allá abajo, acicálate
Porque hoy te va' pa' casa y casi ni traté
Y si tienes problemas, conmigo pégate

Que quiero ponerte a gritar mi nombre, pa' que lo recuerde'
Siempre anda conmigo cuando el novio se le pierde
Carita de nena buena, nunca pierde
Conmigo se siente cabrón, él es solo un resuelve

¿Y qué vas a hacer si me pego
Y te jalo por el pelo?
Pa' mí que te va a gustar
Solo déjate llevar

Y déjame sentirte una vez
Por si no te vuelvo a ver
Luego lo sigo normal con mi vida
Y tú la tuya con él

Pero déjame sentirte una vez (sentirte una vez)
Por si no te vuelvo a ver
Luego lo sigo normal con mi vida
Y tú la tuya con él

Y tú la tuya con él
(Tú la tuya con él)
Yeh, yeh, yeh, yeh
Ey

Baby, yo quiero chingarte, te lo confieso
Pero me conformo solo con un beso
Yo no creo en el amor ni en nada de eso
Pero no sé, porque ahora, siempre que rezo

Le pido a Dios que me deje verte desnuda
Tú te vas, pero esta bellaquera continúa
Me pongo celoso cuando hablas de él (shh)
Dime qué vamo' a hacer

Yo solo quiero hacerlo hasta el amanecer
Porque sé que pronto vas a desaparecer
Si fuera por mí, te llevara de gira
Creo que voy a extrañar la forma esa en que me miras

Con cara de nena buena pero bellaquita
Esos ojitos que los poderes me quita
Quiero verte brincando, toda mojadita
Y tu cara cuando yo te pase la lengüita

Y te traje en whiskicito con agüita tónica
Yo sé que no eres virgen, que no eres católica
Lo más que me gusta es que tú eres media complicá'
Quiero ver cómo tus ojos se ponen con índica

Verdecito' colora'o (colora'o), ao'
No sé si se nota, me tienes desespera'o
Soñando contigo todas las noches, desvela'o
Déjame probarte y cada cual por su la'o, eh

¿Y qué vas a hacer si me pego
Y te jalo por el pelo?
Yo sé que te va a mojar
Solo déjate llevar

Y déjame sentirte una vez (sentirte una vez)
Por si no te vuelvo a ver
Luego lo sigo normal con mi vida
Y tú la tuya con él

(Y tú la tuya con él)
(Tú la tuya con él)
(Tú la tuya con él)
(Tú la tuya con él)"
