Genero,Artista,Titulo,Cancion
Reggaeton,Feid,FRIKI (part. KAROL G),"Bajé pa' Medallo porque ya hicimo' ticket (duro)
Nos pusimo' traje corto, le metimo' bellaco
No importa que nos critiquen

Le dije que pida otra botella pa' que las babies se multipliquen (eh, papi)
Y yo le dije: Obvio
Pero que diga qué va a hacer el otro weekend (wow)

El reggaetón la pone friki, friki
Prendiendo las moña' de krippy, krippy
Llegó en un maquinón
Y está con sus amigas dando vuelta' por la city, city (ey)

El reggaetón la pone friki, friki
Prendiendo las moñas de krippy, krippy
Llegó en un maquinón
Y anda con sus amiga' dando vuelta por la city, city (yeah)

De las cinco, cinco van detrá' de la torta
No tienen celu, nadie se reporta, yeah
Thick thigh, con las nalga' redonda'
Pa' la mesa que llegan es la mesa' que adornan

Se llevan el tip en el panty
Hoy andan sueltas y todas son chanty
Salen a farrear, pero les sale de grati'
Cuando la disco está llena de gatos y gángster'

No sabía si era de noche o si era de día
Estábamo' en lo oscuro, nada se veía
Luego me requisó como la policía
Mezclamo' marihuana con la bebida

Si me apaga la lu'
Yo lo pongo a perder
Me voltio y me dijo: Ese culito, ¿qué talla es? (duro)

Me dio un piquito, qué chimba se siente su boca
De tanto perrear ya nos sobra la ropa
Debajo del hoodie, qué rico me toca
Se le está yendo la mano, pero no me choca

El reggaetón la pone friki, friki (ey)
Prendiendo las moña' de krippy, krippy
Llegó en un maquinón
Y está con sus amiga' dando vuelta' por la city, city

El reggaetón la pone friki, friki
Prendiendo las moña' de krippy, krippy
Llegó en un maquinón
Y está con sus amiga' dando vuelta por la city, city

(Que yo sé que)
(Que yo sé que)
(Que yo sé que)
(Mira, que yo sé que tú)
(Yo sé que tú me quieres probar)
(Que yo sé que tú)
(Yo sé que tú)
(Yo sé que tú)"
Reggaeton,Feid,XX,"Llegó el weekend
Yo no sé tú, pero yo te quiero volver a ver
Desde la última vez
No se le ha ido a mi hoodie tu olor a Chanel (uh)
Las horas se me están volviendo días
Las panas tuyas son la fiscalía
Desde que terminamos yo no te veía
Y te quiero a volver a ver

Así pasen los años, mmm-mmm-mmm
Yo todavía te amo, yeah-eh-eh
Verte con otro me hace daño, mmm-mmm-mmm
Todas las noches te extraño
Me acuesto pensando en ti

Baby, él usa technomarine y yo rompiendo el ap
Él no te necesita pero yo a ti sí
Él comprandote taco y tú esperando yeezys, ¿qué pasa, ma g?, yeh (uh)
Amanecí con ganas de verte
¿Dónde estás pa' yo recogerte?
A los otros bobos diles: ""suerte""
Tú estás suelta si empieza el bellaqueo fuerte (uh)

Así pasen los años, mmm-mmm-mmm
Yo todavía te amo, yeah-eh-eh
Verte con otro me hace daño, mmm-mmm-mmm
Todas las noches te extraño
Me acuesto pensando en ti

Fumo y es pensando en ti
Yeah
Me acuesto pensando en—"
Reggaeton,Feid,AMOR DE MI VIDA,"Hoy salí con otro culo por tu culpa, porque no te puedo ver
Yo no entiendo, si sigo tomando, ¿por qué no te olvido?, yeah
Yo sé que tú no eres agua, pero aún tengo mucha sed
Y bellaquear o hacerlo sin condón solo lo hacía contigo, yeah

Dime si tú vienes o yo voy, yeah
Esto no puede pasar de hoy

Yo siento que tú fuiste el amor de mi vida
Pero nunca tuvimos una despedida
Bebé, qué rico que ya estés aquí
Siempre vas a ser mía (siempre serás para mí)

Prendí un Phillie porque no venías
Yo texteándote y no respondías
A lo mejor tú ya tienes a alguien
Y tampoco me olvidas

Wow

¿Dónde estás? Yo le llego, dime dónde
Yo te conozco y eres adicta a lo under
Anda juiciosa, no está puesta pa'l desorden
Y ahora está cargada de malda' como un revolver

Sería mierda decir que yo no te extraño
No te escribí, pero celebré tu cumpleaño'
Te cogí en esta cama par de año'
Y ahora te mata' con mis fotos en el baño

Yo sé que me sigue'
Ni poniéndoselo a toda' hace' que yo te olvide
Si era como tu dealer
Me la pasaba yendo pa' donde tú vive'

Yo siento que tú fuiste el amor de mi vida
Pero nunca tuvimos una despedida
Bebé, qué rico que ya estés aquí
Siempre vas a ser mía (siempre serás para mí)

Prendí un Phillie porque no venías
Yo texteándote y no respondías
A lo mejor tú ya tienes a alguien
Y tampoco me olvidas

Te ando tirando, yo sé que es tarde
Dime qué andas haciendo, ma', pa' yo llegarle
Yo ya escuché en la calle que andas deprimida
Pero a ti este hombre, mami, no te olvida

Baby, la verdad me duele
Que conseguiste otro gato que ni tú lo quieres
Cometí un error, pagué lo que se debe
Ahora es el turno pa' que tú lo dejes

Dime si tú vienes o yo voy, yeah
Esto no puede pasar de hoy

Yo siento que tú fuiste el amor de mi vida
Pero nunca tuvimos una despedida
Bebé, qué rico que ya estés aquí
Siempre vas a ser mía

Prendí un Phillie porque no venías
Yo texteándote y no respondías
A lo mejor tú ya tienes a alguien
Y tampoco me olvidas (siempre serás para mí)"
Reggaeton,Feid,que putas,"Baby, nadie sabe lo que siento
Cuando hacemos el amor
Todas las noches quiero verte, mami
No había probado ese sabor
Yeah

Yo siento que esto es nocivo, ma'
Qué putas me pasa contigo, ma'
Sin whisky me siento prendido
Chingamos pero somos amigos

Cómo le digo que yo quiero que ella solo chingue conmigo
Cuando yo me sé casi todas sus vueltas
Cómo le digo que me gusta si no quiero dejar de verla
Sé que es sata pero me da de to' si me besa
(Suena)

Yo enrolo uno y ella se lo fuma
Me dice lindo aunque no soy Maluma
Tú usando Nike y ella solo Puma
No es un asalto pero mano' arriba

Que ella, que ella baila, baila, baila
Como si se fuera acabar la vaina
Tú eres real, ellas son China, China
El culito rebota y no canta Guaynaa, yeah

Baby, nadie sabe lo que siento
Cuando hacemos el amor
Todas las noches quiero verte, mami
No había probado ese sabor
Yeah"
Reggaeton,Feid,X20X,"Baby, salí tarde del camello hoy
Aunque tallado estoy, pa' donde sea yo voy, yeah
Por ti lo que sea, mi amor, dime tú dónde estás
No me dio pa' comprarte algo en el mall

Pero aquí tengo un blunt, mediecita de ron
De lo poco que tengo te doy
Por ti me hago pelar

Tú y yo hacemos el amor tan rico
La pasamos hijueputa, donde sea sin tener que ser ricos
Aunque vengo de abajo, siempre sueño con quedarme contigo
Te voy a cuidar, así a mí me toque jalar gatillo

Ponte ready, pa' que hagamos el amor bien rico
La pasamos hijueputa, donde sea sin tener que ser ricos
Aunque vengo de abajo, siempre sueño con quedarme contigo
Te voy a cuidar, así a mí me toque jalar gatillo"
Reggaeton,Feid,Le Pido a DIOS (part. DJ Premier),"Feid
Primo

Si mañana no estoy
Quédate con todas las noches
Que hablamos por el celu, que hicimos el amor
Que manejamos por la calle en el Mercho

Tú mirándome y yo diciéndote: Amor, ¿qué hacemos hoy?
Te juro que de aquí no me voy
Yo en una nota pensando dónde estás
Qué chimba encontrarte
Qué rico bailar, contigo, otro reggaetón

Un hoodie, no tenías gistro
Te di un beso y sonaba la intro
Ey, wow, ese día todo fue distinto
La disco oscura como el vino tinto

Yo sé que a veces la cago hablándote
Pero es que afuera hay muchos cabrones roncándome
Hey, todo' estos culos likeándome
Y tú eres la única que yo quiero estar chingándome

Le pido a Dios que te cuide
Que si me vo, que te cuide
Que sea el aire que respire'
Que lo nuestro nunca expire
Que sea' leal como la mafia
Y que nunca te me vires

Yo diciéndote: Amor, ¿qué hacemos hoy?
Te juro que de aquí no me voy
Yo diciéndote: Amor, ¿qué hacemos hoy?
Te juro que de aquí no me voy

Yo creo que tú has sido mi primera mujer
Ninguna gata me ha hecho ver lo que tú me has hecho ver
La felicidad no tiene precio, pero tiene tu name
Tú siempre me dices Salo y ellas me dicen Feid

No me arrepiento de ni chimba
Si me voy mañana acuérdate que tu sonrisa, bebé, es la más linda
No quiero estar con otras chimbas
Que si te falto, no quiero que te rindas

Le pido a Dios que te cuide
Que si me voy, que te cuide
Que sea el aire que respire'
Que lo nuestro nunca expire
Que sea' leal como la mafia
Y que nunca te me vires"
Reggaeton,Feid,CHIMBITA (part. Sky Rompiendo),"Otra noche más que no contestas
Viendo tus stories pa' ver, tú, dónde estás
Ayer te dejé en casa
Después de que yo te hice la vuelta

Chica, ¿por qué tú no me quieres ver?
¿Será que es porque no soy gángster, ni bichote como él?
Cógelo, que te estoy tirando al cel
Anoche estábamos chingando y hoy no me puedes ver

Mami, con él te sobran billetes de cien
Pero, en verdad, no te sabe comer
Te gasta' los chavos, hace' compra en Chanel
Y tú prefieres, conmigo, irte pa'l motel

A ti te gustan las motoras y el billete
Pero tú estás con ese cabrón desde que tienes diecisiete 
Te gustan las neas, te gusta el siete
Él te tiene en un Mercedes y yo voy por ti en la DT

A ti te corre el perreo, te corre la mari, te gusta el peliculeo
Y así tú no me busques, yo siempre te encuentro
Cuando él esté de viaje, tú me tiras pa' verno'

Chica, ¿por qué tú no me quieres ver?
¿Será que es porque no soy gángster, ni bichote como él?
Cógelo, que te estoy tirando al cel
Anoche estábamos chingando y hoy no me puedes ver

Otra noche más que no contestas
Viendo tus stories pa' ver, tú, dónde estás
Ayer te dejé en casa
Después de que yo te hice la vuelta

Chica, ¿por qué tú no me quieres ver?
¿Será que es porque no soy gángster, ni bichote como él?
Cógelo, que te estoy tirando al cel
Anoche estábamos chingando y hoy no me puedes ver

Hola, amor, ¿cómo estás?
¿Por qué tan perdido, pues?
¿Cuándo va a invitar a parchar a Miami con el Ferxxo, con Sky?
Y yo invito amiguitas, pues, mor
No se me pierda tanto, muah

(Chica, ¿por qué tú no me quieres ver?)"
Reggaeton,Feid,CORONE,"Uh-uh-uh-uh-uh-uh
Oh-oh

Tanto tiempo que ha pasado, yeah
¿Cómo olvidarte, si to' lo que hemos vivido me ha dejado marca'o?
Tú que me esperaste en mi peor momento cuando pudiste haberte marcha'o (yeah)
Cuando en la calle yo me puse más caliente tú nunca te fuiste de mi la'o

No te vayas
Hay muchas pero no hay de tu talla
Baby, tú la nota me estalla'
To' el que te tire se guaya

Llega pa'l hotel, pa' celebrar
Coroné la vuelta y no me voy a ir más
Quédate, no te vaya' (suena)

La mala pa'l que me decía, baby, que tú no me esperaría'
Nunca llegó ese día, pero sí llegó la policía (sí)
Te hice mucho daño cuando yo me fui, pero siempre fuiste mía (yeah)
Le compré al Russo la cadena de diamantes

Porque en la cuenta ya no hay lo mismo de antes
Los carros con el bajo, las motora', los maleantes
Siempre es a fuego, mi gatita gángster (wow)
Pichéale al que te dijo: Quédate (sí)

Tú solo llégale pa' poder perrearte (yeah)
Quiero verte pa' poder gastar la liga que coroné
Tú sabe' cómo me pones

Tú que me esperaste en mi peor momento cuando pudiste haberte marcha'o
Cuando en la calle yo me puse más caliente tú nunca te fuiste de mi la'o

No te vayas
Hay muchas, pero no hay de tu talla
Baby, tú la nota me estalla'
To' el que te tire se guaya
Llega pa'l hotel, pa' celebrar
Coroné la vuelta y no me voy a ir más
Quédate, no te vaya'"
Reggaeton,Feid,PORFA (part. Justin Quiles),"(A ninguna quiero tocar por estar contigo)

Mirándome, preguntando
En mi celu', buscándome
Que ya no amás
Otros cachos en la cara sacándome

To' los mensajes que has leído
Con babys que yo he conocido
A ninguna puedo tocar
Sin pensar que estoy contigo

Te pido, por fa', no te vayas, quédate conmigo
Perdí la cuenta de los días que no te he comido
Me tienes como un loco buscándote, no te consigo
A ninguna quiero tocar por estar contigo

Te pido, por fa', no te vayas, quédate conmigo
Perdí la cuenta de los días que no te he comido
Me tienes como un loco buscándote, no te consigo
A ninguna quiero tocar por estar contigo

(Así como suena, yeh)

Y yo sé que la cagué, no fue una, fueron tres
Y to' lo que te contaron, te contaron al revé'
Lo que hicimos esa noche nunca me lo imaginé
Pero es que estaba' muy dura, no fue que enamoré

Ninguna como tú me droga
Sálvame de esta, quítame esta soga
Quiéreme y no mire' la hora
Que es una noche loba

Te pido, por fa', no te vayas, quédate conmigo
Perdí la cuenta de los días que no te he comido
Me tienes como un loco buscándote, no te consigo
A ninguna quiero tocar por estar contigo

Te pido, por fa', no te vayas, bebé
Que me muero de sed y es a ti que yo quiero virar al revé'
Sé bien que la cagué y las noches son un fantasma
Ahora me visita el karma

No quiero que pienses que
Me las paso aún con estas locas
Yo esa vida la dejé
Pensando en ti, me pasé de copas

Te llamé, suena el ringtone y no doy contigo
Vino tinto y llega tu recinto
Aún recuerdo cuando echábamos el quinto
Tú tan lejos y ahora todo tan distinto

Te pido, por fa', no te vayas, quédate conmigo
Perdí la cuenta de los días que no te he comido
Me tienes como un loco buscándote, no te consigo
A ninguna quiero tocar por estar contigo

Te pido, por fa', no te vayas, quédate conmigo
Perdí la cuenta de los días que no te he comido
Me tienes como un loco buscándote, no te consigo
A ninguna quiero tocar por estar contigo

(Te pido, por fa', no te vayas, quédate conmigo)
(A ninguna puedo tocar sin pensar que estoy contigo)"
Reggaeton,Feid,confesión,"¿Aló?
Cómo explicarte que yo te extraño todavía
Aún tengo gana' 'e tocarte
Cuántas cosa' no te haría, yeh
Viendo tus fotografías
He tenido mil fantasías
Chocando tu piel con la mía
Momentos que no se olvidan

Esta no es hora 'e llamar pero contestaste, yeh
Sé que no vas a colgar porque te gusta escucharme

Yo sé que quieres conmigo
Lo que quiero contigo
Ser el mejor amigo
De tu cuerpo y tus gemidos
Yo sé que quieres conmigo
Lo que quiero contigo
Ser el mejor amigo
De tu cuerpo y tus gemidos, yeh

De tu cuerpo yo quiero ser el BF
Dale duro al gym pa' que no te fatigue'
De niña buena, baby, no te la tire'
Conmigo ere' mala y por eso me active
A tu mami le sacaste ese talento
Caela, ya sin ropa rompamo' el apartamento
Si contigo peco no tengo arrepentimiento
Me gusta porque está pa' mí, bien mojaíta' por dentro
El juego yo te seguí y anda enciñaíto' por ti
Estoy arrebata'o por Black y por la weed
Ponte algo sexy solamente para mí
Baja, que ya llego por ahí

Esta no es hora 'e llamar pero contestaste, yeh
Sé que no vas a colgar porque te gusta escucharme

Yo sé que quieres conmigo
Lo que quiero contigo
Ser el mejor amigo
De tu cuerpo y tus gemidos
Yo sé que quieres conmigo (oh-oh-oh)
Lo que quiero contigo (oh-oh)
Ser el mejor amigo
De tu cuerpo y tus gemidos (oh-oh)"
Reggaeton,Feid,FERXXO VI,"¿Cuántas vece' nos hemos deja'o?
Hasta por un mes nos hemos pelea'o
Siempre vamos a volver
Con este orgullo no vamos a poder

Ya no tengo que estar tan arrebata'o
Si tú me tienes envicia'o
Somos iguales
Yo también he chequeado tus mensajes

Yo no te he sido fiel y tú lo vale'
Sé que soy un hijueputa, pero ven
Haría lo que fuera por ti
Pa' recuperarte otra vez

No, parcе, usted siempre con la misma chimbada
No más

Ya me cansé de to'a estas perras, to'a esta' hoes
Quiero chingarte con las luce' de neón
Ponte la pinta que compramo' en Nueva York
Que vamos pa' París, al Fashion Week en mi avión

Mamacita, te merece' lo mejor
Quiero chuparte donde no te da el Sol
Ese cuerpecito te lo dibujó Dios
¿Por qué te haces la difícil? Si yo te quiero a vos

Yo no te he sido fiel y tú lo vales
Sé que soy un hijueputa, pero ven
Haría lo que fuera por ti
Por recuperarte otra vez"
Reggaeton,Feid,Castigo,"Ya se está poniendo de mañana
No nos vamo' a quedar con las ganas
La disco ya está cerrada
Hoy te quiero decir cosas mala'
Qué linda estás hoy, bebé
Qué lindo el bronceado que vos tenés
A ti todo te queda bien

No sé qué pasa conmigo
Que siempre que bailo contigo
Te digo cosas al oído
Te hablo malo, te quiero dar castigo

Aunque seamos solo amigos
No sé qué me pasa contigo
Que te hablo malo y te doy agresivo
Hoy voy a darte castigo, yeah

Acabamos de llegar, tú solo quiere' farrear
Estas pacas de cien yo te la' quiero gastar
Pa' beber pide aguardiente, la champán pa' regar
La vi moviendo ese culo y rapidito yo le dije

Hola, bebé, ¿qué más?
De esa finca vos no te acordás
La vuelta es que no aguanto más
Y quiero repetir eso que tú me das

Me dañaste la mente
De esa bellaquera aún yo sigo caliente
Escogió la luz, un voltaje de 220
Y con el que ella estaba no aguantó la corriente

Ya-Ya-Ya se está poniendo de mañana
No nos vamo' a quedar con las ganas
La disco ya está cerrada
Hoy te quiero decir cosas mala'
Qué linda estás hoy, bebé
Qué lindo el bronceado que vos tenés
A ti todo te queda bien

No sé qué pasa conmigo
Que siempre que bailo contigo
Te digo cosas al oído
Te hablo malo, te quiero dar castigo

Aunque seamos solo amigos
No sé qué me pasa contigo
Que te hablo malo y te doy agresivo
Hoy voy a darte castigo, yeah

(Y yo voy a hacer una pregunta aquí)
(¿Dónde están esas mujere' soltera'?)

De hace rato yo las veo
Son adictas al perreo
Desde chamaquita' tienen su seteo
Y la que se tire, yo la bateo (de ha—, de-de ha—)

De hace rato yo las veo
Son adictas al perreo
Desde chamaquita' tienen su seteo
Y la que se tire, yo la bateo

Hola, bebé, ¿qué más?
De esa finca vos no te acordás
La vuelta es que no aguanto más
Y quiero repetir eso que tú me das"
Reggaeton,Feid,Mxfix G5,"De afuera no me ven
Tengo 5 en los cristales
Yeah!
Ando medio azarao'
Están empezando a hablar
Mucho de mi en la calle

¡Hey!
No queremos amigos nuevos
No queremos parchar
Toda la mafia está puesta pa'l' dinero
Pero sin olvidar
Que camellamos
Desde cero

La calle puede engañarme
Pero es la bendición
De los que
No están
Que me cuidan
En el cielo
La Virgen te acompañe
Dijeron mis padres
Antes de que el ferxxo
Cogiera vuelo

Otra vez más otra vez marcha
Todo estos cabrones visten duchi de marca
Me fui pa ro' y me compre unas gafas
Pon este outfit, los medios me rechazan
Estaba en el estudio everyday, mi cucho dice que el que camella se
Le da por ley

Seguro mucha gente no nos dio el okay
Yo no quería perder el tiempo so mejor hagamos las paces. Con
Tanta culebra merchase
Ferxxo suena en la calle y en los cases
Estamos en train no queremos que nos atrasen
Coronamos pase lo que pase

La calle puede engañarme
Pero es la bendición
De los que
No están
Que me cuidan
En el cielo
La Virgen te acompañe
Dijeron mis padres
Antes de que el ferxxo
Cogiera vuelo

De afuera no me ven
Tengo 5 en los cristales
Yeah!
Ando medio azarao'
Están empezando a hablar
Mucho de mi en la calle
¡Hey!
No queremos amigos nuevos
No queremos parchar
Toda la mafia está puesta pa'l' dinero
Pero sin olvidar
Que camellamos
Desde cero"
Reggaeton,KAROL G,MI EX TENÍA RAZÓN,"Contigo los días de playa me dan más calor
Por ti me olvidé del pasado y no guardo rencor
Bebé, en la cama me curaste to' lo que me dolía
Me pusiste a latir donde ya no me latía
A ti sí te creo cuando me dices: Mi amor

Mi ex tenía razón
Dijo que no iba a encontrar uno como él
Y me llegó uno mejor
Que me trata mejor

Mi ex tenía razón
Cuando dijo que nadie me lo hará como él
¿Pa' qué le digo que no?
Si me lo hace mejor

Todo me gusta al lado de ti
En la fila, no me tratan como en Fendi
Y soy un maquinón, pero me tenían empty
Me sentía fea como Betty
Y ahora estoy pretty

En la disco, bajándome la botella de Moët
Directo pa' la cama, pa' que me lo hagan como es
De verdad, no sé por qué carajos fue que lloré
Si ahora me doy cuenta que fui yo la que coroné

Contigo, mi amor
Mi cama se lleva mejor, ey
Ya no extraño la vida que tenía
Cuando pienso en lo que decía

Mi ex tenía razón
Dijo que no iba a encontrar uno como él
Y me llegó uno mejor
Que me trata mejor

Mi ex tenía razón
Cuando dijo que nadie me lo hará como él
¿Pa' qué le digo que no?
Si me lo hace mejor

Mi ex tenía razón
Cuando dijo que nadie me lo hará como él
¿Pa' qué le digo que no?
Si me lo hace mejor, ey, mmm"
Reggaeton,KAROL G,OKI DOKI,"(hee, moo ii yo)

Atrás de él, veo qué tenía
Se descuidó y no fue culpa mía

Eh, eh, bebé (oki doki)
Eh, eh, déjate de él
Eh, eh, bebé (oki doki)
Eh, ¿qué vamo' a hacer?

¡Papi!, estate tranqui
Que la Bichota te recoge en el Banshee
Pesaíto tengo el pelo y los panty
Abajito también, pero solo pa’ ti

Esta grandota es una chulería
Se la probé, qué rico lo sabía
Está mejor de lo que yo creía
Está más rica que la que tenía

Perdóname, ey, lo siento bebé (bebé)
Hablando claro, yo queriéndote ¿pa’ qué? (¿pa’ qué?)
Tanto’ culos chimba por usted patié
Devuélveme todo’ lo’ carro’ y los Patek, hmm

Oki doki
Atrás de él, veo que tenía
Oki doki
Se descuidó y no fue culpa mía

Eh, eh, bebé (oki doki)
Eh, eh, déjate de él
Eh, eh, bebé (oki doki)
Eh, ¿qué vamo' a hacer?

Eh, eh, bebé (oki doki, bebé)
Eh, eh, déjate de él (bebé)
Eh, eh, bebé (oki doki, bebé)
Eh, ¿qué vamo' a hacer? (bebé)

Baby, te me cuidas (oki doki)
De este culo, no te olvidas
No me digas puta, el error fue tuyo (oki doki)
Y la vida e’ mía

Baby, te me cuidas (oki doki)
De este culo, no te olvidas
No me digas puta, el error fue tuyo (oki doki)
Y la vida e’ mía

Esta grandota
Es una chulería, -ía, ía, ía

(Mmm, mmm)
(Oki doki)
(Mmm, mmm)
watashi dake no jinsei teniireta
(Mmm, Mmm)

Atrás de él, veo qué tenía
Se descuidó y no fue culpa mía

(Oki doki)
(Oki doki)

anata ga warui
watashinojinsei wa watashi no mono
omotteta yoriyoi kanji
mae yori mo tanoshin deru

(Bichota Season)"
Reggaeton,KAROL G,QLONA (part. Peso Pluma),"Ayer te vi solita
Esa carita bonita
Diablo, qué mamacita

Estás provocándome aunque lo haces sin querer
Ya por ti pregunté y hace más de un mes
Te dejaste con el bobo aquel

Qué hijueputas ganas tengo de besarte
Te vi en una foto y te imaginé sin ropa
Te mentiría si no estoy loca por verte
Con ese jeancito, cómo te ves de culona

Qué hijueputas gana tengo de besarte
Te vi en una foto y te imaginé sin ropa
Te mentiría si no estoy loco por darte
Con ese jeancito, cómo te ves de culona

Nos vamos de guayeteo, fumeteo en la disco, mero perreo
Te pusiste minifalda pa' ver si yo te gateo
Un besito pa' sentir ese goteo
Y prendí la cámara pa' grabarte un video

No te voy a mentir, no paro 'e imaginarme tu culo en tanga
Pónteme de espalda hasta que el Sol salga
Te pongas caliente y todo el cuerpo arda, arda
Te pongas caliente como la arena
Y ese culito blanco, el Sol te lo ponga moreno
Lo tiene grandote por el entreno
Empieza el toque-toque, mojaíta', flow sereno

Te pone caliente como la arena
Y ese culito blanco, el Sol te lo ponga moreno
Lo tiene grandote por el entreno
Empieza el toque-toque, mojaíta'

Qué hijueputas ganas tengo de besarte
Te vi en una foto y te imaginé sin ropa
Te mentiría si no estoy loco por darte
Con ese jeancito, cómo te ves de culona

Qué hijueputas ganas tengo de besarte
Te vi en una foto y te imaginé sin ropa
Te mentiría si no estoy loca por verte
Con ese jeancito, cómo te ves de culona

Ayer te vi solita
Esa carita bonita
Diablo, qué mamacita

Estás provocándome aunque lo haces sin querer
Ya por ti pregunté y hace más de un mes
Te dejaste con el bobo aquel

O-O-Ovy On The Drums
Qué hijueputas ganas tengo de besarte (de besarte)
De besarte, de besarte
Te mentiría si no estoy loca por verte
Por verte, por verte
Cu-cu-cu-culona (culona)"
Reggaeton,KAROL G,ME TENGO QUE IR (part. Kali Uchis),"(Reality)
Hace rato que esto yo lo veía venir
Yeah

Puede que conmigo duermas
Y estemos juntos, pero no te siento, bebé
Y ya yo me tengo que ir
No fue suficiente
Y si otro día te tengo al frente, eh-eh
Me haré la que no siente, eh-eh
De hace rato que esto yo lo veía venir
No vale el cuento que me inventes

Ya no quiero, bebé, que me suba' al cielo (cielo)
Vivimo' actuando como si nos conocemo'
De hace rato que rico no nos comemo' (ey)
¿Quién me va a pagar to' los polvo' que nos debemo'?
'Tamo grande, baby, date un favor
Tampoco fue que no intentamo', fue que no se nos dio
De tanta vuelta que le dimo', uno 'e los dos se perdió
Uno de los dos perdió
Se te acabaron los datos
Yo a ti no te quiero ni pa' pasar el rato
Hasta con mis amigas te pasaste de sato
Papi, tú eres un perro y ando en busca de gato, yeah, yeah

Puede que conmigo duermas
Y estemos juntos, pero no te siento, bebé
Y yo ya me tengo que ir
No fue suficiente
Y si otro día te tengo al frente, eh-eh (eh-eh)
Me haré la que no siente, eh-eh
De hace rato que esto yo lo veía venir
No vale el cuento que me inventes

No me voy sin despedir
Pero sabes que me toca ir
You know I could give you a good life
Make such a good wife, turn that dream reality (reality)
Now, you don't wanna kill me, oh (oh)
Yo sentiría lo mismo if I were you (you)
Pero algo aquí no es suficiente
Confundes pasado con presente, yeah, yeah

Y de repente
Ya te das cuenta que la vida es fuerte, fuerte
Vivo gratis en su mente
Aunque nunca pedí ser un residente, eh, eh-eh
Y de repente (y de repente)
Ya te das cuenta que la vida es fuerte, fuerte
Vivo gratis en su mente (en su mente)
Aunque nunca pedí ser un residente, eh, eh-eh

Puede que conmigo duermas
Que estemos juntos, pero no te siento, bebé
Y yo ya me tengo que ir
No fue suficiente
Y si otro día te tengo al frente, eh-eh
Me haré la que no siente, eh-eh
De hace rato que esto yo lo veía venir
No vale el cuento que me inventes

La-ra-la-la-la
You know I could give you a good life
La-ra-la-la-la-la
Yeah
Y estemos juntos, pero no te siento, bebé
De hace rato que esto yo lo veía venir
No vale el cuento que me inventes"
