Genero,Artista,Titulo,Cancion
Reggaeton,Maluma,"Un Polvo (part. Bad Bunny, Arcángel, Ñengo Flow y De La Ghetto)","(Sex)

Ey, eh
Oh

Mi cuerpo extraña tu piel
Y ese aroma que dejaste en mí, impregnado
Hace que quiera volvértelo hacer (baby)
Derramaste tanto sudor en mi cama

Fueron testigos las paredes y la almohada
De esos besos que, en la oscuridad, te daba
Siempre respondía todas tus llamadas (mami linda)
Pasto y otra cosa más, tú me buscabas a mi

Quiero volver a explorar tu cuerpo
Ver tu cara cuando lo tengas adentro
Motívate, utilízame, dime cuándo te vuelvo a ver
Pa’ hacértelo como te lo hice ayer

Quiero volver a explorar tu cuerpo
Ver tu cara cuando lo tengas adentro
Motívate, utilízame, dime cuándo te vuelvo a ver
Pa’ hacértelo como te lo hice ayer

(Austin, baby)

Echamos un polvo, echamos dos
(Wow)
Tú eres mi diosa y yo soy tu dios
(Amen)
Siguió la noche y echamos tres
Conmigo se te quitó el estrés
Mírame a la cara y dime qué ves

Mi cuerpo quiere algo de ti
Y yo no sé qué es, pero sé que sí
Hay algo que me atrae de ti, de ti
Por eso quiero verte y tenerte aquí

Quiero volver a explorar tu cuerpo
Ver tu cara cuando lo tengas adentro
Motívate, utilízame, dime cuándo te vuelvo a ver
Pa’ hacértelo como te lo hice ayer

Quiero volver a explorar tu cuerpo
Ver tu cara cuando lo tengas adentro
Motívate, utilízame, dime cuándo te vuelvo a ver
Pa’ hacértelo como te lo hice ayer

Hace tiempo quería
Meterte como te lo metí aquel día
Yo hablándote malo
Mientras te venias

Baby, tengo cienes
Pero, chingando, tú eres quien la tiene
Traje un libra de kush
Pa’ que enrolle y la queme

Me acuerdo de la otra vez
Cuando te di en todas las poses
Y en cuatro te grabé
Desde que me pegué
Me clavo todos los culos que salen en la TV

Pero tú está más dura
Te hiciste el culo, las tetas y la cintura
Contigo, me voy acapella, sin armadura

No te hagas la difícil y dime que sí
Ya tú me conoces, ya a ti te metí
El Snapchat que enviaste, ya lo vi (ya lo vi)
Me gustó y lo repetí (lo repetí)
Yeh

Te fuiste conmigo, y sin miedo, lo hicimos
Nos devoramos, más nos comimos
Llevo tres días en cautiverio contigo
Llevo tres días venciendo el peligro

Devorándote sigo y no voy a parar
Llega sin panty y déjate llevar
Se le moja ese toto conmigo
Y en su mismo cuarto la pongo a gritar

Una nave espacial, no estoy pa’ bucear
Es algo especial, una baby social
Nalgas demasiadas, la saco a pasear
Se quiere iniciar y no es artificial

La conocí, chingamos el mismo día
Hablamos a tu amiga, hicimos una orgia
Desde el momento, ahora estás crecía'
Pero yo fui el que rompí todas las averías

Quiero volver a explorar tu cuerpo
Ver tu cara cuando lo tengas adentro
Motívate, utilízame, dime cuándo te vuelvo a ver
Pa’ hacértelo como te lo hice ayer

Quiero volver a explorar tu cuerpo
Ver tu cara cuando lo tengas adentro
Motívate, utilízame, dime cuándo te vuelvo a ver
Pa’ hacértelo como te lo hice ayer (Geezy, baby)

Cada que invito
Te quitas los vistos
En cuatro, como tú no he visto
De ese culo, soy adicto

Qué rico lo mueves
Si así es el cielo, que me lleve Cristo
Y si tú quieres y yo quiero
Moverme a romperte ese crico

Todavía recuerdo tu ropa interior
Cuando fumas, los ojos te cambian de color
En mi ropa Versace, se quedó tu olor
Esta vez será mejor que la anterior

Los chulitos, los chulitos (Hear This)
Ten cuidao' (Music), que llegaron los chulitos
Austin, baby (Maluma)
(De La Gezzy), Maluma
(Arcangel y Ñenguisi)
Díselo Luian (alright, alright, baby)
Mambo Kingz

Eso es sex
Puerto Rico
Colombia
BiVi
Uoh, Josh
The secret code, baby
Yeh
Mambo Kingz
Díselo Luian
Arcangel, De La Ghetto
Bad Bunny, Ñengo Flow
Y el Dirty Boy"
Reggaeton,Maluma,Marinero,"Oh-oh, oh-oh
Oh-oh, oh-oh
Oh-oh
Ooh, eh, yeh

Que pare de sufrir, eso to' el mundo dice
Lloro porque tengo cicatrices
Y dolores en el alma
Sé que me has hecho falta

Hablo de mis entrañas para ser sincero
Sé que fui el culpable, por eso te pierdo
Hablabas, no te escuchaba
Solo desnuda era que me gustabas

Hoy
Se llegó el momento
Solo hay ruido en nuestra habitación
Y silencios que gritan: Adiós

Mientras me dabas tu corazón
Yo era un marinero buscando amor
Iba por cada puerto como si nada
Entre más olas, más naufragaba

Mientras me dabas tu corazón
Yo era un marinero buscando amor
Iba por cada puerto como si nada
Entre más olas, más naufragaba

Yeh-yeh
Uoh-ooh
Yeh-yeh
Oh-ooh
Yeh-yeh, oh-oh

Aquellos días, qué bien lo recuerdo
Tú ya graduada y yo en el colegio
Tú me enseñaba cosas que me enamoraban
Y practicaba con otras cuando no estabas

De eso, me arrepiento hoy
Soy un idiota, mi papel fue lastimarte
Bebo y me arrepiento hoy
Porque cuando volví al muelle, era muy tarde, yeh-yeh

Hoy
Se llegó el momento
Solo hay ruido en nuestra habitación
Y silencios que gritan: Adiós

Mientras me dabas tu corazón
Yo era un marinero buscando amor
Iba por cada puerto como si nada
Entre más olas, más naufragaba

Mientras me dabas tu corazón
Yo era un marinero buscando amor
Iba por cada puerto como si nada
Entre más olas, más naufragaba

Yeh-yeh
Uoh-ooh
Yeh-yeh
Oh-ooh
Yeh-yeh, oh-oh

Sin orgullo, te dejo saber
Y algún día lo vas a entender
Si te dejo volar a otros brazos
Será por tu bien

Mientras me dabas tu corazón
Yo era un marinero buscando amor
Iba por cada puerto como si nada
Entre más olas, más naufragaba

Mientras me dabas tu corazón
Yo era un marinero buscando amor
Iba por cada puerto como si nada
Entre más olas, más naufragaba

Eh, yeh"
Reggaeton,Maluma,Mojando Asientos (part. Feid),"Maluma, dice

Hoy me levanto un día más y tú no estás
Eres el sueño 'el cual no quiero despertar
En otra vida yo te elegiría igual
No está de más que lo volvamos a intentar

Por más que duela
Busquemo' la manera
Resolvamos el problema
Sé que me quiere' aunque no quieras

Bebé, volvamos pa' aquellos tiempos
Noche de travesuras, allá en mi carro, mojando asientos
Sé que tú lo recuerdas, como yo lo recuerdo
Yo te pasaba el Phillie y me daba' güaro, qué bueno' tiempos

Dime qué vas a hacer
Cuando otro man toque tu piel
¿Pensará' en mí, estando con él?
Dime, dime
Dime qué vas a hacer
Cuando otro man toque tu piel
¿Pensará' en mí estando con él? 
Dime, dime

Tú sirviéndome güaro y yo pasándote el humo
El taxi pa' tu casa, pa' la 301
Tú me diste el cuadre y no le diste a ninguno
Yo te mandaba krippy y tú foticos del culo 

Contigo en noche buena 
Me llevaste pa' donde tu abuela
Te perdiste la uni de buena
Tú sabe' que en Enviga'o cooperan

Y me dijeron que 'tás soltera
Quiero bajarte esa bellaquera
Yo sé que tengo chavo' en la cartera
Pero quiero parchar contigo en el Lleras

Re-re-reina, mi amor, yo te extraño, bebé
Qué hijueputa chimba sería vernos otra vez
En serio, amor, no te vuelvas a perder
De tocarte no dejes a nadie, bae

Bebé, volvamo' a aquello' tiempo'
Noche de travesura', aquí en mi carro, mojando asientos
Sé que tú lo recuerdas como yo lo recuerdo
Yo te pasaba el Phillie y me daba' güaro, qué bueno' tiempos 

Tus foto' en el fondo, las borré 
Tus cartica' de cuaderno, las guardé 
La tanguita que me diste aquella ve'
La primera ve' que fuimo' a un motel 

Por lo' recuerdos, cuando me tirabas por texto
Recógeme despué' del concierto
Estando con tus amiga', siempre te inventaba' pretexto' 
Pa' terminar en mi apartamento

Por más que duela
Busquemo' la manera
Resolvamos el problema
Sé que me quiere' aunque no quieras

Bebé, volvamos pa' aquellos tiempos
Noche de travesuras, allá en mi carro, mojando asientos
Sé que tú lo recuerdas como yo lo recuerdo
Yo te pasaba el Phillie y me daba' güaro, qué bueno' tiempos

(I miss and love you, baby)
(Dime qué vas a hacer)
Jajaja, Maluma, ba-ba-baby
(Cuando otro man toque tu piel)
(¿Pensará' en mí estando con él?)
(Dime, dime)
Jaja
Kevin ADG y Chan El Genio 
RudeBoyz
Ily Wonder (A aquello' tiempo')
(Maluma, baby)
(Aquí en mi carro mojando asientos)
2040 y pico
(Sé que tú lo recuerdas como yo lo recuerdo)
RudeBoyz
(Y me daba' güaro, qué bueno' tiempo')
Ily Wonder"
Reggaeton,Maluma,La Reina,"¿Quién te dijo que necesitas maquillaje?
Si está de más ponerle filtros a un paisaje
¿Qué te hace falta? Dime tú, si brillas en la multitud
¿Cuál fue el pendejo que te acomplejó?

Mami, es que tú ere' una reina, mírate bien
Que hasta el espejo se sorprende cuando te ve
Mami, es que tú ere' una reina, mírate bien
El que te dijo que eras suave, es porque de belleza no sabe

Te ves criminal, así natural, tú ere' otra vuelta
Tú ere' otra cosa, date cuenta
Sin joyas, brillas
A ti se te reza de rodillas
Ma, tú eres la octava maravilla

Qué clase, qué dura, qué estilo, qué torque
Qué nota, qué bella, qué fina, qué porte
Tú necesitas un tipo que te aporte
Que te dé flores, no golpe'

Bebecita, qué clase, qué dura, qué estilo, qué torque
Qué nota, qué bella, qué fina, qué porte
Tú necesitas un tipo que te aporte
Que te dé flores, no golpe'

Porque ere' la reina, mírate bien
Que hasta el espejo se sorprende cuando te ve
Mami, es que tú ere' una reina, mírate bien
El que te dijo que eras suave, es porque de belleza no sabe

Yeah-yeah
Maluma, ba-ba-bae (ba-ba-baby)
KEITYN
(Dímelo, Edge)"
Reggaeton,Maluma,Hola Señorita (Maria) (part. GIMS),"Se rumora que su nombre es María
María, María
Quién diría que me enamoraría
Aquel día, aquel día (Maluma, baby)

Heya, hola, señorita, dis-moi si tu penses qu'on s'est tout dit
Je ne sais pas danser donc ce soir j'me fais tout petit
Ella, una señorita bella de la cabeza a los pies
Pero lo que más me gusta es cuando habla francés

Baila, baila, mamacita
Baila, baila, mamacita

De LA hasta Francia, baby, qué elegancia
Perfum Chanel, Dior, baby, qué fragancia
Estás rica, delicious, you look scrumptious
I just wanna be inside, feel your emotions

Me mandas un emoji de esos que son como el diablo
¿Por qué no hablas de frente? Baby, háblame claro
En este cuento, yo no quiero ser el malo
No mandes señales, vámono' directo al grano

Dime (dime) si tú y yo nos vamos
A un lugar lejano
Sigue ese movimiento
To-to-to-ton-ton, to-to-to-to-ton-ton

Se rumora que su nombre es María
María, María
Quién diría que me enamoraría
Aquel día, aquel día (Maluma, baby)

Heya, hola, señorita, dis-moi si tu penses qu'on s'est tout dit
Je ne sais pas danser donc ce soir j'me fais tout petit
Ella, una señorita bella de la cabeza a los pies
Pero lo que más me gusta es cuando habla francés

Baila, baila, mamacita
Baila, baila, mamacita

Dis-moi c'que tu veux, dis-moi c'que t'attends de moi
Je t'ai vu apparaître et disparaître comme un ninja
T'entends des choses sur moi, tu t'méfies je le sais déjà
J'te retiens tu m'échappes, silencieux comme un chat

Bon courage à celui qui t'mariera
J'vais m'contenter de t'appeler María
Sous le soleil de Santa Monica
Ou Santa Maria, eh

Dis-moi c'que tu veux, dis-moi c'que t'attends de moi
Je t'ai vu apparaître et disparaître comme un ninja
T'entends des choses sur moi, tu t'méfies je le sais déjà
J'te retiens tu m'échappes, silencieux comme un chat

Toujours à l’affût, à l’affût de quelques dineros
Pas facile d'aimer avec un cœur derrière les barreaux
J'ai perdu beaucoup de sang, il serait temps d'me faire un garrot
Juste après l'apéro, na lingui yo, te quiero

Se rumora que su nombre es María
María, María
Quién diría que me enamoraría
Aquel día, aquel día (Maluma, baby)

Heya, hola, señorita, dis-moi si tu penses qu'on s'est tout dit
Je ne sais pas danser donc ce soir j'me fais tout petit
Ella, una señorita bella de la cabeza a los pies
Pero lo que más me gusta es cuando habla francés

Baila, baila, mamacita
Baila, baila, mamacita

Se rumora (I love you) que su nombre es María
(Je t'aime) María, (te amo) María
Quién diría que me enamoraría (en todos lenguages)
(Mamacita) aquel día, aquel día (Maluma, baby)"
Reggaeton,Maluma,"La Tierra Del Olvido (part. Carlos Vives, Fanny Lu, Fonseca y Andrea Echeverri)","Como la Luna que alumbra, por la noche los caminos
Como las hojas al viento, como el Sol espanta el frío
Como la tierra a la lluvia, como el mar que espera a el río
Así esperó tu regreso, a la tierra del olvido

Como naufragan mis miedos, sin navego en tu mirada
Como alertas mis sentidos, con tu voz enamorada
Con tu sonrisa de niña, como me mueves el alma
Como me quitas el sueño, como me robas la calma

Tu tienes la llave de mi corazón, yo te quiero
Más que a mi vida, por que sin tu amor, yo me muero
Tu tienes la llave de mi corazón, yo te quiero
Más que a mi vida, por que sin tu amor, yo me muero

Como la Luna que alumbra, por la noche los caminos
Como las hojas al viento, como el Sol espanta al frío
Como la tierra a la lluvia, como el mar espera a el río
Así esperó tu regreso, a la tierra del olvido

Como naufragan mis miedos, sin navego en tu mirada
Como alertas mis sentidos, con tu voz enamorada
Con tu sonrisa de niña, como me mueves el alma
Como me quitas el sueño, como me robas la calma

Del llano traigo un joropo, traigo en prima el bordón
Afinando la garganta, veo un viajero cantador
Que grita con pecho abierto, lleno de paz y emoción
Colombia patria querida, te llevo en mi corazón

Tú tienes la llave de mi corazón, yo te quiero
Más que a mi vida, por que sin tu amor, yo me muero
Tú tienes la llave de mi corazón, yo te quiero
Más que a mi vida, por que sin tu amor, yo me muero

Cuando estoy fuera de casa como te recuerdo
Vivir en el paraíso, es vivir en tu suelo

Desde el Amazonas, derechito a La Guajira
Sé que larga es la ruta, pero la montaña inspira
De sur a norte, de oeste a este
Mi Colombia está creciendo y así se siente

Así se siente, si me atrevo a comparar
A mi tierrita con tu cuerpo escultural
Ambas tan bellas, como las flores
Ambas me encantan, son mis amores

Tú tienes la llave de mi corazón, yo te quiero
Más que a mi vida, por que sin tu amor, yo me muero
Tú tienes la llave de mi corazón, yo te quiero
Más que a mi vida, por que sin tu amor, yo me muero"
Reggaeton,Maluma,Ella Es Mi Fiesta (part. Carlos Vives),"La conocí una mañana para una fiesta de enero
Nos ennoviamos en marzo el compromiso iba enserió
El matrimonio fue en mayo con ceremonia y festejo
Y no han pasado los años como si fuera el primero
En un instante se develan los misterios
La cenicienta del amor esta encantada
Era tan linda que alumbraba las estrellas
Era tan buena que todo se me olvidaba

Así, se fue esclareciendo
Así, me fui diluyendo
Así, y ya nunca yo supe de mi
La conocí una mañana para una fiesta de enero
Nos ennoviamos en marzo el compromiso iba enserió
El matrimonio fue en mayo con ceremonia y festejo
Y no han pasado los años como si fuera el primero

Como si hubiera sido ayer
No pasa el tiempo
Y aun sigue intacta mi locura por su amor

Lai la, lai le
Mi locura por su amor
Lai la, lai le
Aun sigue intacta
Lai la, lai le
Lai la, lai le

Ella es mi fiesta, mi aventura, mi brebaje
Cuando la vida me tiene desencantado
No necesito vencer la capa de ozono
Ella es la nave que me lleva hacia el espacio
Así, se fue esclareciendo
Así, me fui diluyendo
Así, y ya nunca yo supe de mi

La conocí una mañana para una fiesta de enero
Nos ennoviamos en marzo el compromiso iba enserió
El matrimonio fue en mayo con ceremonia y festejo
Y no han pasado los años como si fuera el primero
Como si hubiera sido ayer
No pasa el tiempo
Y aun sigue intacta mi locura por su amor

Lai la, lai le
Mi locura por su amor
Lai la, lai le
Aun sigue intacta
Aun sigue intacta
Lai la, lai le
Aun sigue intacta
Mi locura por su amor
Lai la, lai le
Mi locura por su amor

La conocí una mañana para una fiesta de enero
Nos ennoviamos en marzo el compromiso iba enserió
El matrimonio fue en mayo con ceremonia y festejo
Y no han pasado los años como si fuera el primero
Es la favorita, la mujer más buena

La que más me gusta de todas las nenas
Es la mamacita, se me agua la boca
Que no mas la miro y todo me provoca
Como si hubiera sido ayer
No pasa el tiempo
Y aun sigue intacta mi locura por su amor

Lai la, lai le
Mi locura por su amor
Lai la, lai le
Aun sigue intacta
Aun sigue intacta
Lai la, lai le
Aun sigue intacta
Mi locura por su amor
Lai la, lai le
Mi locura por su amor."
Reggaeton,Maluma,Madrid (part. Myke Towers),"(RudeBoyz)

Linda, ¡qué bien te ves!
Según las redes, me olvidaste
Pero ese cuento, ¿quién te lo cree?
Solo mi número borraste

¿Pa' qué me quieres mentir?
Yo tampoco te he olvidado
Desde aquella noche que te fuiste a Madrid
Hasta mi vieja te extraña

¿Y tú no ves que yo me muero por ti?
Por aquí todo ha cambiado
Excepto el amor que yo sentía por ti
Ese culito me extraña

Vuelve otra vez, aunque sea una vez, loco me traes
Parce, me tienes mal de la cabeza
Hace cuánto tiempo no me besas
Qué chimba sería si tú regresas

Vuelve otra vez, aunque sea una vez, loco me traes
Parce, me tienes mal de la cabeza (me tienes crazy, baby)
Hace cuánto tiempo no me besas
(Yo sigo esperándote, bebé)

Te comes a otro y yo pensándote
Cuando podía estar bellaqueándote
Baby, yo te quiero, aunque no se note
Yo aquí sigo firme, aunque no se nos dé

¿Pa' qué me quieres mentir? (Dime)
Yo tampoco te he olvidado
Desde aquella noche que te fuiste a Madrid
Hasta mi vieja te extraña

¿Y tú no ves que yo me muero por ti?
Por aquí todo ha cambiado
Excepto el amor que yo sentía por ti
Ese culito me extraña

Borraste mi número, pero tú te lo sabes de memoria
Y me paso siempre viendo tus historias
Tú me quitabas los Calvin Klein
Yo a ti te quitaba los Victoria
Y no falla que por la mente me corra

Un pasaje pedí y volé hasta Madrid
Pensando en todas las noches y todas las poses que te di
Me enamoré de ti, no sé si tú de mí
Soy fanático número uno de hacerte gemir

¿Con quién ahora el espejo empañas?
Ese culito me extraña
No me hace na' la champaña, quiero una baby de España
Tengo que darle a la ganja, ella la mente me daña

¿Y a quién engañas? Dicen dizque me olvidó
Y le envié un DM y ni siquiera lo miró
No dijo que se iba, tampoco viró
Por tu captura, estoy dando más de un millón

¿Pa' qué me quieres mentir? (Dime)
Yo tampoco te he olvidado
Desde aquella noche que te fuiste a Madrid
Hasta mi vieja te extraña

¿Y tú no ves que yo me muero por ti?
Por aquí todo ha cambiado
Excepto el amor que yo sentía por ti
Ese culito me extraña

Yo-yo', yo-yo'
El baby de las babies
Maluma, baby
Con Myke Towers
Papi Juancho
(RudeBoyz)
RudeBoyz
Dímelo, Edge
PR, Medallo"
Reggaeton,Maluma,Hawái (remix) (part. The Weeknd),"Yeah

So now he's your heaven (oh, yeah)
You're lying to yourself and him to make me jealous (oh, no)
You put on such an act when you're sleeping together
All this 'cause I said I don't want marriage (marriage)
I don't want marriage (hey)

I'd rather go half on a baby
'Cause at least I know that it's not temporary (temporary)
And at least we'll share something that's real (oh, yeah)
I can tell that you're just tryna feel (oh, no)

Puede que no te haga falta na', aparentemente na'
Hawái de vacaciones, mis fеlicitaciones
Muy lindo en Instagram lo que postеas (oh, yeah)
Pa' que yo vea cómo te va, pa' que yo vea

Puede que no te haga falta na', aparentemente na'
Hawái de vacaciones, mis felicitaciones
Muy lindo en Instagram lo que posteas
Pa' que yo vea cómo te va de bien, pero te haces mal
Porque el amor no se compra con na'

Miéntele a todos tus seguidores
Diles que los tiempos de ahora son mejores
No creo que cuando te llame me ignores
Si después de mí ya no habrán más amores

Tú y yo fuimos uno
Lo hacíamos en ayuna' antes del desayuno
Fumábamos la hookah y te pasaba el humo
Y ahora en esta guerra no gana ninguno

Si me preguntas, nadie tiene culpa
A veces los problemas a uno se le juntan
Déjame hablar, porfa', no me interrumpas
Si te hice algo malo, entonces discúlpame

La gente te lo va a creer
Actúas bien ese papel
Baby
Pero no eres feliz con él

Puede que no te haga falta na', aparentemente na'
Hawái de vacaciones, mis felicitaciones
Muy lindo en Instagram lo que posteas (oh, no)
Pa' que yo vea cómo te va, pa' que yo vea

Puede que no te haga falta na', aparentemente na'
Hawái de vacaciones, mis felicitaciones
Muy lindo en Instagram lo que posteas (posteas)
Pa' que yo vea cómo te va de bien, pero te haces mal
Porque el amor no se compra con na'

(So now he's your heaven)
(You're lying to yourself and him to make me jealous)
This is the remix
(You put on such an act when you're sleeping together) The Weeknd
Papi Juancho (all this 'cause I said I don't want marriage)
Maluma, baby
(I don't want marriage)"
Reggaeton,Maluma,"Aloha (part. Beéle, Rauw Alejandro, Darell, DJ Luian y Mambo Kingz)","Estar a tu lado es lo mejor que me ha pasao' (Ra-Rauw)

Tú me gustas así natural
Yo soy loco con verte bailar
Matar la liga pa' ti es normal
Hacemos un video y nos vamo' viral

Baila, morena
Combinamos como mar y arena
Tú te luces sin lucir la' prendas
Tú me like, espero que entienda'

Aloha, tu sonrisa me enamora
Te beso y pasan las hora'
Conmigo no estarás sola
Ey-yeh, yeh

Aloha, tu sonrisa me enamora
Te beso y pasan las horas
Conmigo no estarás sola
Eh, eh

Uh-la-la-la, uh-la-la-la
Ra-pa-pa-pa-pa-pa
Uh-la-la-la, uh-la-la-la
Ra-pa-pa-pa-pa-pa (Papi Juancho)

Qué bien me modela lo que compra en еl mall
Piel canelita sin usar bronceador
Par dе mojitos y se pasa en alcohol
Ahí es que me da el call

Lo hicimos en Medallo y luego en Cartagena
Me enamoré de ti bajo la Luna llena
Nunca imaginé que fueras tú mi nena
Aparte, mi parcero, le llevan la buena

Y, morena, ven, baila, sexy, ven, baila
Si tienes amiga', pues traila'
Vamo' pa' la playa, olvida la toalla
Sabe', el Papi Juancho no falla

Y, morena, ven, baila, sexy, ven, baila
Si tienes amiga', pues traila'
Vamo' pa' la playa, olvida la toalla
Sabe', el Papi Juancho no falla

Uh-la-la-la, uh-la-la-la
Ra-pa-pa-pa-pa-pa
Uh-la-la-la, uh-la-la-la
Ra-pa-pa-pa-pa-pa

Mirando el reloj
Sé que te busco a la' do'
Pero me desespera
Porque esperar a verte no puedo

Ayer soñé con tus beso'
En tu cama caí preso
Quiero regalarte el mundo entero
Y de tu vida, ser tu compañero, ooh

Estar a tu lao'
Es lo mejor que me ha pasao'
De tu boca, estoy enviciao'
Y tu cuerpo me tiene mal acostumbrao'

Estar a tu lao'
Es lo mejor que me ha pasao'
En la cuenta, tengo un par de mile' achocao'
¿Que tal si pa' Ibiza nos vamo' escapao'?

Aloha, tu sonrisa me enamora
Te beso y pasan las hora'
Conmigo no estarás sola
Ey-yeh, yeh

Aloha, tu sonrisa me enamora
Te beso y pasan las horas
Conmigo no estarás sola
Eh, eh (here we go again!)

Forever together, que te vaya' never (eso es así)
Yo tengo a la más dura, rompiste to' lo' level'
Yo te llevo a coger Sol, caluroso el weather (pa' que sepa')
Y pa' reírnos, un poco de Fruity Pebbles

Contigo no quiero una noche, quiero una vida entera (eso es así)
Y de nuevo quiero verte y no aguanto la espera
Ya no tenerte como que me desespera (hi, sweety)
Ya yo me enchulé y si supiera' (stop that shit)

Un besito lo' domingo', yo me siento en el limbo
Tú nunca me entendiste y yo me volví hasta gringo
I love you forever, my loba (oh, my God)
Yo soy tuyo, y si quieres, me roba' (eso es así)

Su mirada, el camino correcto
Corriendo voy al cielo cuando siento sus beso'
La miro, ella me baila, bailando me le acerco
Todos nos miran raro, ella y yo nos entendemo'

Aloha, tu sonrisa me enamora
Te beso y pasan las hora'
Conmigo no estarás sola

Beéle
Papi Juancho (Darell)
Maluma, ba-ba-baby
Yeh-yeh (Ra-Rauw, ey)
Hear This Music
Rauw Alejandro
Jowny
Díselo, Luian
Ma-Ma-Mambo Kingz
Duars Entertainment
YannC
(El Súper Da-Dakis)
BF
Neneto"
Reggaeton,Maluma,HP,"(Maluma, baby)

Ella no está buscando novio
Quiere salir a joder (yeh, yeh)
Quiere olvidarse de ese bobo
Porque el cabrón le fue infiel (oh, no, no no)

Le rompieron el corazón
Y no busca a nadie que se lo reponga
Solo quiere alguien que se lo ponga
Ella quiere un man que no la llame y que no joda
Pa’ remplazar al perro que no la valora

Quiere aprovechar que está más buena y más de moda
Empezó a meterle a gym desde que quedó sola
Las envidiosas dicen que eso se lo hizo el cirujano
Pero es ella misma queriendo salir del daño

Quiere salir, fumar, beber
Subir un video pa’ que lo vea él
Pa’ que se dé cuenta de lo que perdió
Pa’ que el hijo de puta se sienta peor

Quiere salir, fumar, beber
Subir un video pa’ que lo vea él
Pa’ que se dé cuenta de lo que perdió
Pa’ que el hijo de puta se sienta peor (peor)

Ella no está buscando novio (no busca novio, no)
Quiere salir a joder (yeh, yeh)
Quiere olvidarse de ese bobo (yeh, yeh, yeh, yeh, yeh)
Porque el cabrón le fue infiel (oh, no, no no)

Y cuando se suelta
No existe una amiguita que la pare
No quiere un novio pa’ rendirle cuentas
No necesita ningún HP en el party
Que la pare

Y cuando se suelta
No existe una amiguita que la pare
No quiere un novio pa’ rendirle cuentas
No necesita ningún HP en el party
Que la pare

Quiere salir, fumar, beber
Subir un video pa’ que lo vea él
Pa’ que se dé cuenta de lo que perdió
Pa’ que el hijo de puta se sienta peor

Quiere salir, fumar, beber
Subir un video pa’ que lo vea él
Pa’ que se dé cuenta de lo que perdió
Pa’ que el hijo de puta se sienta peor (peor)

Ella no está buscando novio (no busca novio, no)
Quiere salir a joder (yeh, yeh)
Quiere olvidarse de ese bobo (yeh, yeh, yeh, yeh, yeh)
Porque el cabrón le fue infiel (oh, no, no no)

Ella no está buscando novio (no busca novio, no)
Quiere salir a joder (yeh, yeh, yeh, yeh)
Para olvidarte de ese bobo
Cuenta conmigo, mujer
Yeh, yeh, yeh, yeh"
